post_id,comment_id,author,body,score,created_utc,parent_id,text_length,date
1knx3n4,msn4od6,eternalmortal,"Trump's foreign policy is definitely a move away from traditional US policy - in the ME and the rest of the world. He's after a deal - any deal - and he's looking out exclusively for US interests (but more often than not his own personal interests) rather than the interests of regional allies like Israel. When it's in his interest, he makes deals with allies, and when it's in his interest he makes deals with other countries in opposition to those same allies. Individual personalities also play a way bigger role now - if Trump doesn't like someone, or if they get into some sort of spat, that affects things in a real way now. Just a completely new dynamic in American foreign policy. 

But I'm hoping that Trump's understanding of US interests in the region more often than not aligns with Israel's on the ground interests - allies often have the same interests anyways. A peaceful region, trade deals, and military hardware sales are all shared interests between the US and Israel. If something is a win for Trump and a win for Israel simultaneously, he's going to do that thing. His premier foreign policy win in the region was the Abraham Accords, so I'm hoping he adds to them to further cement his legacy there. His rhetoric has been strong against an Iranian nuclear weapon, but we'll have to wait and see what a deal looks like. His sanctions softening towards Syria comes alongside Sharaa saying he'd potentially be interested in making peace with Israel. He's been pretty ambivalent about Gaza, and resumed Biden-frozen arms deals. He's gotten Edan Alexander home without any prisoners in exchange, and without a forced ceasefire that would have prevented the strike on Mohammed Sinwar. 

For some issues that hasn't been the case. His Houthi policy excludes Israel - as long as the Houthis leave US interests alone and don't touch the boats, he doesn't care if they shoot missiles at Tel Aviv. His friendship with Qatar could go either way - Qatar shields Hamas leadership but also is trying to assert itself as a potential peace broker in the region, so this one's a toss up. 

So while Trump and Israel aren't totally in lockstep foreign policy wise in the region, his interests still more or less align with Israel's - I hope.",6,2025-05-16 15:40:13+00:00,t3_1knx3n4,2245,2025-05-16
1knx3n4,msns999,unclemusclzhour,"Trump wants to normalize peace and relations with the greater Middle East and Arab world. This doesn’t discount Israel in any way, but he’s not given an easy task of normalizing relations between Israel and other middle eastern countries when Netanyahu vows to up his offensive. 

I’m not saying Netanyahu is wrong to go back to Gaza, but I also don’t think Trump is wrong to work for more long term peaceful relationships with stable middle eastern countries.",5,2025-05-16 17:34:43+00:00,t3_1knx3n4,460,2025-05-16
1knx3n4,mso4kdm,davidds0,נתניהו. ליגה אחרת.,5,2025-05-16 18:36:02+00:00,t3_1knx3n4,18,2025-05-16
1knx3n4,mso735c,K0TEM,"נתניהו, ליגה ז'",4,2025-05-16 18:48:48+00:00,t1_mso4kdm,15,2025-05-16
1knx3n4,msoy3ta,ichbineinschweinhund,I think this is a gratuitous shot at Netanyahu. Did you expect Bibi to accompany Trump on this trip. Of course the US has foreign policy goals in the Middle East that don't involve Israel or peripherally involve Israel. This was a dealmaking trip for investment in the US although the President did talk security and a desire to expand the Abrahamic Accords. Trump's commitment to Israel's security is unwavering. As it should be.,4,2025-05-16 21:06:34+00:00,t3_1knx3n4,430,2025-05-16
1knx3n4,mspcg8e,bakochba,"No it isn't. He literally made a deal with the Houthis that excluded Israel, excluded Israel from the deal with Saudi Arabia, excluding Israel from the Iran deal and excluded Israel from negotiations with Hamas.",2,2025-05-16 22:25:59+00:00,t1_msoy3ta,211,2025-05-16
1knx3n4,mspg422,ichbineinschweinhund,"Israel is not the center of US foreign policy. The ""Deal"" with the Houthis was simply to stop bombing because they agreed to our conditions. Our economic goals within the region, with the Saudis or anyone else are, quite frankly, none of Israel's business. And FYI, there is no Iran deal and if Trump can prevent Iran from going nuclear, that's a huge win for Israel and the entire world. You need to stop pissing on everything the US has done to protect and defend Israel because Trump went to the dance with a different girl.",2,2025-05-16 22:57:41+00:00,t1_mspcg8e,527,2025-05-16
1knx3n4,msr5p9j,CoolMick666,"Has Israel been harmed by these deals? 

Thus far, lifted US sanctions on Israeli ""Settlers,"" hostages have been returned, Houthis have agreed to stop attacking commercial shipping, Jewish students are safer on US college campuses, no calls for ceasefires or attempts to stop US weapon supplies to Israel, attempted to create normalization, and get the Houthis to stop attacking Israel. 

Compare to the previous US administration.....",0,2025-05-17 06:16:55+00:00,t1_mspcg8e,435,2025-05-17
1knx3n4,msm5bug,Fruitcake6969,"Why does Trump need to go to Israel? He hasn’t gone to Egypt or Jordan either, are they sidelined as well? Idk, it feels like the media is making this deeper than it really is but who knows i can be wrong.",2,2025-05-16 12:33:33+00:00,t3_1knx3n4,205,2025-05-16
1knx3n4,msm61hz,Fenroo,Israel is not the cause of all the problems in the Middle East and doesn't have to be involved in every solution in the Middle East. Trump's visit resulted in countries pledging to invest in American industries. There's no Israel nexus and no need for Israeli involvement.,1,2025-05-16 12:38:01+00:00,t3_1knx3n4,272,2025-05-16
1knx3n4,msmcx7i,MajorMess,"on the one hand I think the danger is high that trump gets bored with Bibi and Israel, especially if no quick solutions pop up.

On the other hand this ME trip seems like an Abraham’s accord victory lap to me. He’s traveling around and shows everyone there’s big $$$ to make if you deal with the US. It seems to me this trip is a signal to ME nations what the carrot could look like, all party and bling, no time for droopy war stuff",1,2025-05-16 13:18:46+00:00,t3_1knx3n4,433,2025-05-16
1knx3n4,msnjqt3,CholentSoup,"Trump does what's best for Trump and after that what he thinks is best for USA. He has loads of people around him who don't like Israel and have an attitude of 'Why Israel?' 

So instead of acting like a jilted lover Israel should relax a little. Don't worry, Donny could have done worse. In some ways this was a message to Israel that they're not counted as a mid eastern country rather a western ally that happens to be in the mid east.",1,2025-05-16 16:53:24+00:00,t3_1knx3n4,438,2025-05-16
1knx3n4,msocsdk,schtickshift,I hope that Jews realise that they should be neutral about US presidents and not throw in their lot with one side or the other and become part of Americas culture wars which have nothing to do with Judaism or Israel. If Trump does big deals with the Middle East that secure energy supplies and end threats to the disruption of those supplies then his job there is done. The nuances of who controls which territory stop mattering as long as the oil and gas flow uninterrupted and securely and the same for world trade through the Suez Canal. Israel only matters because of the instability of the rest of the Middle East. If that’s stabilized then Israel becomes a local problem not an American one. Soon there will be a Democrat in the White House because Trump is rapidly cooking his goose in US politics and the Israeli government will be on record as 100% throwing their lot in with the worst president in American history.,1,2025-05-16 19:17:46+00:00,t3_1knx3n4,925,2025-05-16
1knx3n4,msmxeim,AsceticHedonist47,"Friends, American here. Don't take articles regarding Trump on CNN seriously. They've been known for the last decade + as a left wing spin network, and they try to make Trump look bad whenever possible. 

Trump, and far more importantly the majority of us still support you fully. You guys have to worry about your neighbors, we have to worry about the never-ending slough of propagandized bullshit our media poors down our throats.

I wish you all the best, stay safe, we still love you here in America!",1,2025-05-16 15:05:05+00:00,t3_1knx3n4,504,2025-05-16
1knx3n4,msrncqd,Tomas-T,"good job BB

another good thing thay you ruined in your own hands just to keep the coalition",0,2025-05-17 09:21:38+00:00,t3_1knx3n4,92,2025-05-17
1kkykeu,mshjnj0,Am-Yisrael-Chai,"The AMA has officially ended! 

Unfortunately, we ran out of time. OP might be able to circle back later to answer some more questions, so we will leave comments unlocked but will not be accepting new “top level” submissions. 

Thank you to everyone who participated, and thank you u/IsraelPolicyForum and Michael for this opportunity!",1,2025-05-15 17:53:43+00:00,t3_1kkykeu,335,2025-05-15
1kkykeu,mrynz75,abc9hkpud,"Historically, many Arab Palestinians and their allies have believed that Israel is illegitimate and should not exist. This view is not unique to Hamas, but goes back to before the Hebron Massacre of 1929.

Do you think that this long-standing view can be changed among the majority of the Palestinian public and in the wider Arab world? If so, how? If not, how can we reach a long lasting peace, and how can we assure that existing peace agreements are honored long term if people do not accept Israel as legitimate? 

From my point of view, as long as a large number of Palestinians and their allies view Israel itself as illegitimate, it will be hard to come to a permanent peace, and exisiting peace agreements will be unstable because people who do not think Israel should exist may be tempted to break those agreements when they think that Israel is weak.",74,2025-05-12 19:09:45+00:00,t3_1kkykeu,860,2025-05-12
1kkykeu,msgl9ha,IsraelPolicyForum,"I think we have to separate between Palestinians the rest of the region. Palestinians do indeed largely hold that view, and it is never going to change so long as their current political status of statelessness under Israeli occupation continues. That is not to lay the entirety of the blame at Israel’s feet for Palestinian attitudes, which you correctly point out pre-date Israel’s creation, but it is unrealistic to expect Palestinians to accept Israel when they view it as the source of their modern day problems and the barrier to their own independence and sovereignty. If someone’s position is that there can be no agreements until their attitude changes, then there will never be an agreement.

The historical circumstance of Arab opinion is a good model for how to overcome this problem. Israel is not seen as legitimate by large segments of Egyptians and Jordanians either, but the peace with both countries has held. The key to getting durable agreements needs to be a combination of giving populations what they want—in the case of Egypt, it was withdrawing from the Sinai, and in the case of Jordan, it was Oslo—and maintaining Israeli strength to act as a deterrent, and to hope that as the conflict with the Palestinians lessens and then recedes, attitudinal changes over time will follow. The alternative is to consign Israel to permanent war without ever testing the limits of what is possible, which to my mind is not a real or a satisfying alternative.

If we think of peace between the two sides as absolute and all-encompassing, we will always be disappointed. It would be great if Israelis and Palestinians could get there, but that will take decades following an agreement. The aim should be to get to a spot where both sides get what is most important to them, turn the conflict into an aberration rather than a constant, and then do the difficult part of turning a cold peace into an actual, durable relationship.",14,2025-05-15 15:07:21+00:00,t1_mrynz75,1938,2025-05-15
1kkykeu,msgw0is,abc9hkpud,"Thanks for your reply. I hope that this doesn't sound too cynical, but why are you optimistic that Palestinians will accept Israel as legitimate even in the case of a peace agreement? At least from my view, it seems that rejection of Israel is really baked into the religious identity (land should be Islamic, Islamic conquests spread justice and Muslim rule should prevail in Israel and over holy sites) and political identity (Palestinians as native vs Israelis as outsiders or colonists) of many Palestinians. Why do you think that something so crucial to how Palestinians view themselves can change, even if a peace agreement is present? Why do you think this change is likely rather than eternal conflict or renewed conflict whenever Israel seems weak and divided?",8,2025-05-15 15:59:41+00:00,t1_msgl9ha,769,2025-05-15
1kkykeu,mrydcis,omeralal,"Abbas is relatively old at the moment (89), so it's very possible is reign will end soon. Is there a specific new leader to the Palestinians that you think will emerge? (This isn't the main part of my question, but it's just nice to know what you think of it)
 
So my main question is: Is there anyone you think Israel can work with in order to achieve peace? Are you or anyone in the organisation working with Palestinian leaders (both official and unofficial) to plan a day after together?",39,2025-05-12 18:17:05+00:00,t3_1kkykeu,491,2025-05-12
1kkykeu,msglyv7,IsraelPolicyForum,"I'll take this opportunity to note a reliable laugh line when it comes to Abbas, which is that he is indeed old, in poor health, and a chain smoker, and also that his father died at 102 or 103 in a car crash, so Abbas may end up lasting another 20 years!

There are Palestinian leaders that Israel can work with to achieve stability—Abbas fits into this category, as does Hussein al-Sheikh, for instance—but to achieve peace will require a Palestinian leader with legitimacy among Palestinians. Arafat had that legitimacy due to his revolutionary credentials, but no other Palestinian today will achieve any real level of legitimacy without democratic elections, and that is not something that Israel can create or a problem it can solve for the Palestinians. It is on Palestinians to demand change from their leadership, and on Palestinian leadership to actually reform and give themselves the ability to lead.

As for who might replace Abbas one day, it is impossible to foresee who will be in the picture when he eventually leaves the scene. If that were to happen tomorrow, there would be jockeying between al-Sheikh, Jibril Rajoub, Mohammed Dahlan or someone from his camp like Nasser al-Qidwa, potentially Majed Faraj, and Mahmoud al-Aloul. Many still place their hopes in Marwan Barghouti, who is serving multiple life sentences for his role in directing suicide bombings during the Second Intifada. Ultimately, the best scenario would be newer and younger leadership that emerges organically. Palestinians like Samir Sinjilawi would fit that bill, but the person or persons who come next in line immediately after Abbas will be from the old guard.",7,2025-05-15 15:10:49+00:00,t1_mrydcis,1655,2025-05-15
1kkykeu,mrzmrip,abc9hkpud,"As someone who has spent a lot of time in academia, what is your opinion of how Israel and Zionism are taught at the university level in the US? Do you think that both supportive and critical voices are reflected in typical university coursework? If not, how can this change?

I am asking because I saw a blog post that described things at Harvard Divinity School as heavily skewed against Israel, and I was wondering if that represents your experience, and if so how might things be changed ( )",27,2025-05-12 22:06:56+00:00,t3_1kkykeu,495,2025-05-12
1kkykeu,msgnzht,IsraelPolicyForum,"It's been a while since I have been in academia (I finished my coursework for my PhD 17 years ago), and one of my fun facts is that I never studied Israel and never even took an academic class about Israel at any level, so I definitely not the best person to answer this question. But from what I can tell anecdotally, it greatly varies from university to university, and from professor to professor.

Part of how this changes is by having standards for what and how things are taught; there is no question to me that a very pro-Israel professor and a very anti-Israel professor would both be capable of teaching classes on Israel and Zionism that are accurate and objective. Part of it is also about viewing Israel as a regular topic of study rather than a Rorschach test for every professor's political opinions about the Middle East or foreign policy writ large. As far as I know, there isn't a crisis in academia about how China or Russia or Myanmar is taught, and it shouldn't be that difficult to get to a similar spot when it comes to Israel.",14,2025-05-15 15:20:44+00:00,t1_mrzmrip,1049,2025-05-15
1kkykeu,msgp7om,IsraelPolicyForum,"Interesting way of framing it. In light of everything going on, I would sequence it as Peace for Land, but it's not quite so black and white. Hamas needs to be taken care of in Gaza through a combination of continued military operations and a political/diplomatic strategy that sidelines and marginalizes them, and only after that can there be talk of wrapping Gaza into a larger Palestinian political project. But in the West Bank, there need to be changes in Israeli policy—not unilateral withdrawal or disengagement— that relate to land, and giving Palestinians more sovereignty today before any political agreement while ensuring that there is actual territory for them to have a viable state one day. The policy suggestions related to future Israeli settlement activity that my colleagues and wrote here - [ \- would be a good place to start.",13,2025-05-15 15:26:45+00:00,t1_mryhub2,847,2025-05-15
1kkykeu,mrymtqk,Redneckia,"Land for peace failed spectacularly, who's trying that again?",7,2025-05-12 19:03:51+00:00,t1_mryhub2,61,2025-05-12
1kkykeu,mshhqjt,Own-Quit-4231,Reminder that it was a huge success with Jordan and Egypt.,4,2025-05-15 17:44:42+00:00,t1_mrymtqk,58,2025-05-15
1kkykeu,mshsqmv,KlorgianConquerer,"Jordan and Egypt are fundamentally different: The Egyptian nationalist project does not need the land of Israel. Israel gave nothing to Jordan.

The Palestinian nationalist project identifies Tel Aviv as their homeland as much as Egyptians identify Cairo.",7,2025-05-15 18:38:24+00:00,t1_mshhqjt,255,2025-05-15
1kkykeu,mrz51fy,Sabotimski,"Empirical evidence would suggest that only Israel is willing and able to bring lasting peace to Gaza as well as Judea and Samaria. Therefore Israel should exercise full control over these territories with local administration for peaceful Arab communities (like a Mukhtar system. Do you agree? If not, what other realistic solution do you envision that would effectively transform Palestinian Arab society?",18,2025-05-12 20:35:08+00:00,t3_1kkykeu,406,2025-05-12
1kkykeu,msgrdp9,IsraelPolicyForum,"I disagree. If Israel did that, it would find it hard to identify many peaceful Arab communities. Palestinians do not want to live under Israeli control, and they are not going to be satisfied with economic peace. Palestinian society has also advanced way beyond the mukhtar system; we are no longer dealing with an agrarian society with strong tribal leaders and identities.

Palestinians have a lot of hard work to do, and it's on them to do it. Everything from curbing incitement to holding their leaders accountable to figuring out how to move beyond their tragic history. But none of this can be divorced from Israeli policy, as if somehow daily military occupation is less radicalizing than something a high school student reads in a book about Israel.",4,2025-05-15 15:37:16+00:00,t1_mrz51fy,758,2025-05-15
1kkykeu,ms8ckpw,jhor95,Can you describe your day after plan and how to deradicalize the Arabs?,16,2025-05-14 07:10:57+00:00,t3_1kkykeu,71,2025-05-14
1kkykeu,msgsnc8,IsraelPolicyForum,"I'll put it here for those who are interested - [ \- but the quick summary:

Establish basic law and order with a Palestinian-led security force, establish basic governance with a provisional technocratic administration that can provide services, and give the PA jobs it can actually succeed it in order to build on those successes and pave the way eventually for a PA return to Gaza.

Once this first phase is working, have the U.S. lead a process with Arab states to deal with what remains of Hamas, rebuild Gaza, and overhaul the Palestinian political process. None of this is quick, and will take 3-5 years to implement. It cannot happen until ongoing large-scale military operations are over.",6,2025-05-15 15:43:23+00:00,t1_ms8ckpw,697,2025-05-15
1kkykeu,msh5zos,jhor95,">PA return to Gaza.

Ah yes the simple bandaid solution that neither the Israelis nor the Palestinians want. They're beyond corrupt so sure let's give them more power until Abbas dies and it all goes down the tubes again",8,2025-05-15 16:48:51+00:00,t1_msgsnc8,220,2025-05-15
1kkykeu,msiefqd,manic_cauliflower,Right there with you haver,3,2025-05-15 20:25:17+00:00,t1_msh5zos,26,2025-05-15
1kkykeu,mslwajk,jhor95,"Because it's simple logic based on all the numbers, but they're (pretend I SpongeBob'd this):""the de facto representative of the Palestinian people"" so that's the best decision riiiight?!",1,2025-05-16 11:32:21+00:00,t1_msiefqd,187,2025-05-16
1kkykeu,mry7k0n,KlorgianConquerer,"You have [consistently]( pushed Israel to make a deal with Hamas, and even supported [unity]( of Hamas and Fatah. Did you also support keeping the cold 'peace' with Hamas before October 7th? I have met members of the Israel policy forum before the war, and I was consistently told increasing numbers of Gazan workers coming into Israel and aid into Gaza before the war was good. Was there ever any apology for being incorrect, or any public statement admitting you were wrong? Introspection on why you were wrong? What did the Israel Policy Forum learn?",103,2025-05-12 17:49:00+00:00,t3_1kkykeu,553,2025-05-12
1kkykeu,ms5fw0o,manic_cauliflower,"I love it when people who were not there for October 7, haven't spent two months under missiles from Gaza (not even talking about the north and 10 months of Hezbollah rockets), not had terrorist attacks happen every week near them, reading skewed statistics of terrorists re ""civilian casualties"" and not listening to Israeli side, forgetting that the Red Cross have not visited any of the hostages in over 500 days, not watched humiliating videos of what Hamas makes hostages do, forgetting that we offered a 5 million dollar award and safe passage of captors for EACH hostage, living a charmed existence in the West believe they have a grasp on the situation.

Yes I'm mad.",17,2025-05-13 20:07:24+00:00,t1_mry7k0n,675,2025-05-13
1kkykeu,msliidh,Molde99,"I’ve read most of the OP’s responses here and I’m sorry to say they are mostly delusional. It’s simply regurgitating the same ideas that have gotten us to this point.

This week alone we’ve had multiple missiles hurled at us. The Houtis might not be Hamas but it’s all connected. We’re living in a very different reality in Israel than many people are conscious of. All this talk about being a better partner for peace? Israel has nearly given up its very existence in previous proposals and it still was not enough! 

Culture and mentalities in the Middle East and in Islam are vastly different from their counterparts in western societies. Yes, people are people and I am sensitive to the human element, but that doesn’t mean ignoring reality either. 

All of this isn’t an academic exercise or a geopolitical pastime. It’s real life and yes, I’m mad too.",4,2025-05-16 09:34:17+00:00,t1_ms5fw0o,857,2025-05-16
1kkykeu,msokl6b,manic_cauliflower,"I'm an olah, lived in the war for a year and three months, had to leave Israel very unfortunately (lost my job, couldn't find a new one, you know the cost of living. I'd much rather be with you guys under the missiles, can't stand being away). So I live in diaspora now. I find it frustrating as fuck. People don't know tf they are talking about, and believe they're entitled to an opinion just because. I'm mad at them too and basically live online with my Israeli friends. 

Yes I'm (it's) sad.",2,2025-05-16 19:57:52+00:00,t1_msliidh,496,2025-05-16
1kkykeu,msgkmzq,IsraelPolicyForum,"Thanks for the question; it's an important one.

I am absolutely in favor of a hostage and ceasefire deal, and partially it is because of wanting to take events into account and update my thinking. As I wrote in the first piece you linked to here, I was not in favor of a deal early on, but it is clear after nineteen months that there is no purely military way out of this, and there is an imperative to get hostages out while they are still alive. It will involve terrible tradeoffs, but that’s how foreign policy works, where leaders almost always have to choose between bad options and decide which is the least bad.

Before October 7, I had no illusions about what Hamas is and what they wanted, but I believed that breaking their grip on the Gaza economy would ultimately weaken them, and that the risk of a war in Gaza to get rid of them was not worth it so long as they were adhering to quiet for quiet. That was obviously a mistake. I have written a bunch of times in the immediate aftermath of October 7 about what and why I got things wrong, and how it should impact my analysis and that of anyone who does this for a living, most prominently here -[ \- but also in the last paragraph in particular here - [",17,2025-05-15 15:04:15+00:00,t1_mry7k0n,1218,2025-05-15
