post_id,comment_id,author,body,score,created_utc,parent_id,text_length,date
1l2ld3e,mvugeig,Important-Work644,"I don't agree with Iran having nukes, but all recent actions have shown having nukes is the only way to guarantee your security as a country.",11,2025-06-03 21:47:42+00:00,t3_1l2ld3e,141,2025-06-03
1l2ld3e,mvtx8r9,The-M0untain,Iran won't stop at Israel. They'll likely attack Arab nations too.,24,2025-06-03 20:13:36+00:00,t1_mvttavb,66,2025-06-03
1l2ld3e,mvuqtfj,eskimospy212,The main reason for Iran to build nukes is to prevent the US from invading them. Their neighbor Iraq as compared to North Korea is an excellent object lesson on this.,3,2025-06-03 22:44:03+00:00,t1_mvttavb,166,2025-06-03
1l2ld3e,mvztgmf,CentJr,Who the hell is willing to invade a country that's geographically worse than Afghanistan?!,2,2025-06-04 18:15:26+00:00,t1_mvuqtfj,90,2025-06-04
1l2k827,mvtks98,The-M0untain,Iran will use that money to fund terrorists. Iran can't be allowed to have sanctions relief until it stops funding terrorism. Giving up the nuclear enrichment is not enough.,21,2025-06-03 19:11:37+00:00,t3_1l2k827,173,2025-06-03
1l2k827,mvv2zlg,macross1984,"Not unexpected demand coming from Iran. After all, its finance is in tatter from all the money that went in supporting terrorist proxies and Syria's Assad with no tangible return for its effort.

Effect of sanctions and neglect of infrastructures have led to average Iranians losing patience with supreme religious leader and Iran is in its most vulnerable right now with nationwide truckers strike that brought commerce to standstill.

Iran is desperate for relief and we should not give in to their demand.",6,2025-06-03 23:51:21+00:00,t3_1l2k827,508,2025-06-03
1l2k827,mvzpfro,Delvhammer,Iran wants sanction relief before deal and US says it will give it once proven they are following deal. This is not going anywhere and Iran is just dragging their collective feet to buy time.,2,2025-06-04 17:56:27+00:00,t3_1l2k827,191,2025-06-04
1l2k827,mw1qu64,Political_breeds,We call for impeachment of the Supreme Leader. He is putting the national security of the country at risk by stalling the Nuke Deal.,2,2025-06-05 00:05:11+00:00,t3_1l2k827,132,2025-06-05
1l2k827,mvtj420,1-randomonium,"It is interesting that Trump seems so eager to offer sanctions relief to Russia, but not to Iran.",-25,2025-06-03 18:59:37+00:00,t3_1l2k827,97,2025-06-03
1l2k827,mvtwefx,snarky_answer,Is it? Hasn’t he kept sanctions on Russia and has talked about increasing them? Has he let up any sanctions on Russia?,13,2025-06-03 20:09:34+00:00,t1_mvtj420,118,2025-06-03
1l2k827,mvvbiy2,Buschlight696969,"Not only has Trump not given Russia any sanction relief, he let a Biden-era exemption, which gave Russia access to US payment services for energy transactions, expire. 

Source:",10,2025-06-04 00:41:36+00:00,t1_mvtwefx,177,2025-06-04
1l2k827,mvwsciv,1-randomonium,He offered to lift most of the sanctions and let Russia keep most of its captured Ukrainian territory in order to get Putin to come to the table. He has never been generous to Iran.,-6,2025-06-04 06:54:13+00:00,t1_mvtwefx,181,2025-06-04
1l2k827,mw1xhq7,snarky_answer,No he didnt. Youre lying about something thats easily verifiable.,1,2025-06-05 00:44:28+00:00,t1_mvwsciv,65,2025-06-05
1l2k827,mvujhq6,Substantial-Newt7809,"That isn't particularly interesting at all, it's the least surprising thing I've heard in weeks.",-3,2025-06-03 22:03:55+00:00,t1_mvtj420,96,2025-06-03
1l1pdh8,mvmtopk,cdoink,How much of Trump's meme coin Iran would buy for the privilege of signing this deal again.,1741,2025-06-02 18:35:17+00:00,t1_mvmqn89,90,2025-06-02
1l1pdh8,mvmv1gp,telaughingbuddha,A MAGA bible and Ayatollah has to convert. Trump will baptise,82,2025-06-02 18:41:49+00:00,t1_mvmu886,61,2025-06-02
1l1pdh8,mvn6mvi,PM_ME_YOUR_CATS_PAWS,This is like some Viking age stuff lol,33,2025-06-02 19:37:27+00:00,t1_mvmv1gp,38,2025-06-02
1l1pdh8,mvnjita,MaintenanceInternal,Explain to me your nailed god.,25,2025-06-02 20:39:01+00:00,t1_mvn6mvi,30,2025-06-02
1l1pdh8,mvnlfh7,djauralsects,The dead Jewish guy on a stick?,21,2025-06-02 20:48:02+00:00,t1_mvnjita,31,2025-06-02
1l1pdh8,mvnu6gg,watch_out_4_snakes,More likely the other way round…taco isn’t the best at negotiation.,3,2025-06-02 21:30:50+00:00,t1_mvmv1gp,67,2025-06-02
1l1pdh8,mvo0fj9,birdman424344,"So back to what Obama had negotiated, perfect",43,2025-06-02 22:02:40+00:00,t1_mvmqn89,45,2025-06-02
1l1pdh8,mvrvc40,superiority,Probably a best-case scenario tbh.,8,2025-06-03 14:16:27+00:00,t1_mvo0fj9,34,2025-06-03
1l1pdh8,mvn2lhs,Prize_Midnight_4566,Basically about to agree to the same deal Obama agreed to.,106,2025-06-02 19:18:00+00:00,t1_mvmqn89,58,2025-06-02
1l1pdh8,mvpjdc9,SYLOH,That's what happens when your electorate is so uneducated it lacks object permanence skills.,29,2025-06-03 03:26:06+00:00,t1_mvnumgm,92,2025-06-03
1l1pdh8,mvr87cy,Paraphrasing_,"I really like this comment, you should have more arrows pointing up.",3,2025-06-03 12:07:16+00:00,t1_mvpjdc9,68,2025-06-03
1l1pdh8,mvpxtlo,HeavyExplanation45,This is the way…it’s the bestest deal EVER,3,2025-06-03 05:13:52+00:00,t1_mvnumgm,42,2025-06-03
1l1pdh8,mvo3guw,Ytrewq9000,Just the claim that they made a deal lol. The art of the deal my friends is TACO.,14,2025-06-02 22:18:52+00:00,t1_mvmqn89,81,2025-06-02
1l1pdh8,mvmuxil,victorspoilz,"Couldn't have John Kerry's deal on the books, not when Mr. Dealmaker is fatting around",68,2025-06-02 18:41:17+00:00,t1_mvmqn89,86,2025-06-02
1l1pdh8,mvndd4a,beachedwhale1945,"Which is exactly what the last deal did, the one Trump despised and tossed out.",171,2025-06-02 20:09:57+00:00,t1_mvmv319,79,2025-06-02
1l1pdh8,mvpmtlj,Xurbax,"Yeah, but that wasn't \his\ deal. 
(Until he forgets later that he made the deal - declares it bad, again, and rips it up... again.)",9,2025-06-03 03:50:14+00:00,t1_mvndd4a,132,2025-06-03
1l1pdh8,mvnzg7n,go3dprintyourself,Hopefully this includes regulating the cooperation of Iran on providing transparency to have the facilities checked compared to how they used to push back on it,1,2025-06-02 21:57:32+00:00,t1_mvndd4a,160,2025-06-02
1l1pdh8,mvng2az,Grumblepugs2000,Does it make the limits permanent? That alone would make it better than the last deal,-32,2025-06-02 20:22:40+00:00,t1_mvndd4a,85,2025-06-02
1l1pdh8,mvnhodi,beachedwhale1945,"I’ll want to compare them, but I’m personally against permanent limits in treaties and prefer expiration-and-renegotiation a decade or two down the road. Allows for more flexibility as geopolitics change.",28,2025-06-02 20:30:17+00:00,t1_mvng2az,204,2025-06-02
1l1pdh8,mvnjycm,No_Talk_4836,Probably as permanent as Trump keeps the deal in place.,15,2025-06-02 20:41:03+00:00,t1_mvng2az,55,2025-06-02
1l1pdh8,mvop826,scroopydog,"I’m personally an advocate of the next dem president in office to tear up everything Trump built out of spite, in tradition with how he’s setting precedent.",3,2025-06-03 00:20:26+00:00,t1_mvnjycm,156,2025-06-03
1l1pdh8,mvoqdir,Mazon_Del,You do realize that writing down that the limit is permanent doesn't ACTUALLY make it permanent right? That nothing stops Iran from just going ahead and continuing to enrich.,4,2025-06-03 00:27:17+00:00,t1_mvng2az,174,2025-06-03
1l1pdh8,mvo1qmw,LucyEleanor,I like how this comment is down voted because its vaguely pro-trump. Lol I love reddit,-10,2025-06-02 22:09:37+00:00,t1_mvng2az,86,2025-06-02
1l1pdh8,mvo2478,Grumblepugs2000,Not even pro Trump just a question lol 😂,-15,2025-06-02 22:11:35+00:00,t1_mvo1qmw,40,2025-06-02
1l1pdh8,mvnnr1b,trollgrock,Ya so basically what Obama's deal did. Hmmm wonder if they are going to have international teams investigate on periodic basis to ensure adherence... you know like Obama's deal.,58,2025-06-02 20:59:08+00:00,t1_mvmv319,177,2025-06-02
1l1pdh8,mvnh10r,DGlen,Hmm....sounds oddly familiar. Can't be right though because I thought that was just like the worst deal ever made right?,18,2025-06-02 20:27:13+00:00,t1_mvmv319,120,2025-06-02
1l1pdh8,mvmwvma,sumregulaguy,This. Natural uranium is 99% U-238 isotope and 1% U-235. You need 3-5% of the total to be U-235 for nuclear fuel for power plants. Nuclear bomb needs 90%+. The latter is much harder to acquire and practically impossible to do in secret.,38,2025-06-02 18:50:33+00:00,t1_mvmv319,236,2025-06-02
1l1pdh8,mvnh5hx,The-M0untain,"India, Pakistan and North Korea managed to do it in secret. Everyone was shocked when they conducted their nuclear tests.",34,2025-06-02 20:27:48+00:00,t1_mvmwvma,121,2025-06-02
1l1pdh8,mvnk6ar,No_Talk_4836,"That was also before the establishment of the American eye in the sky spy network. 

North Korea did everything underground to avoid that.",18,2025-06-02 20:42:06+00:00,t1_mvnh5hx,138,2025-06-02
1l1pdh8,mvoc35x,Automatic-Pirate-533,Thankfully there is no ground in Iran,48,2025-06-02 23:05:53+00:00,t1_mvnk6ar,37,2025-06-02
1l1pdh8,mvodofx,No_Talk_4836,"Yes, very lucky that all of Iran floats in mid-air",10,2025-06-02 23:14:39+00:00,t1_mvoc35x,50,2025-06-02
1l1pdh8,mvoexev,talshyar99,Don’t forget Israel…,1,2025-06-02 23:21:34+00:00,t1_mvnh5hx,20,2025-06-02
1l1pdh8,mvnx2q8,senfgurke,Going from 3-5% enriched uranium to >90% takes much less separative effort than going from natural uranium to 3-5%.,14,2025-06-02 21:45:30+00:00,t1_mvmwvma,115,2025-06-02
1l1pdh8,mvng2zi,5up3rK4m16uru,Doesn't enrichment get progressively easier the further you are?,11,2025-06-02 20:22:45+00:00,t1_mvmwvma,64,2025-06-02
1l1pdh8,mvp5mkj,SolarBear28,CANDU nuclear power plants run on unenriched uranium. I think that would have been the safer play if Iran wants nuclear power so badly.,1,2025-06-03 01:58:34+00:00,t1_mvmwvma,135,2025-06-03
1l1pdh8,mvoq06j,FerragudoFred,Neither did the last one……#smfh,4,2025-06-03 00:25:04+00:00,t1_mvmv319,31,2025-06-03
1l1pdh8,mvn0n16,nithrean,"While i don't like it, I also suspect that this is the case, no matter what they have claimed publicly. Iran wants nukes.",15,2025-06-02 19:08:33+00:00,t1_mvmvfie,121,2025-06-02
1l1pdh8,mvn7jyh,BorisAcornKing,"They want the ability to make nukes at short notice, but they probably don't want to actually have nukes.

Outwardly Having nukes comes with substantial diplomatic consequences. Being able to make them on very short notice gives you some of the advantages of nukes (deterrence/leverage) without the disadvantages of them (imagined 'what if' scenarios about your stability, upkeep costs, vulnerability to a first strike)

Reminder that other middle eastern nations have pursued nukes in the past, and Israel ended these ambitions. Maybe Iran is different in that it's subterranean facilities aren't vulnerable to the Israelis, but I believe that if they were seriously pursuing nukes, Israel would have struck their sites directly long ago. They haven't been shy about it.",17,2025-06-02 19:41:56+00:00,t1_mvn0n16,771,2025-06-02
1l1pdh8,mvp5umi,Osyris-,"Yep agree and this was echoed by other intelligence reports that they don't appear to be actively trying to build one. Blinken said last year they have enough enriched uranium to get it to weapons grade in around seven days. So if they wanted to build one they basically could have already.

Unlike Syria and Iraq whose programs heavily relied on their reactors, which Israel destroyed, Irans is more advanced and dispersed. Their use of centrifuges means they could be back up and running in a short amount of time.

Given a strike on their facilities won't shut down their efforts, it's hard to imagine this going well and not giving the hardliners the justification they want to build one.",1,2025-06-03 01:59:55+00:00,t1_mvn7jyh,692,2025-06-03
1l1pdh8,mvn3e41,Future-Employee-5695,Who can blame them when you have Israel and sunni countries all around you .,-4,2025-06-02 19:21:50+00:00,t1_mvn0n16,76,2025-06-02
1l1pdh8,mvn7uqt,Sunnysidhe,"Plus, the Russian invasion of Ukraine has shown everyone that the only thing that matters is having nukes. If you have them, other countries are more kindly tui leave you alone. If you don't, you are fair game.",21,2025-06-02 19:43:23+00:00,t1_mvn3e41,210,2025-06-02
1l1pdh8,mvn7pja,BabyDog88336,"Iran almost certainly has nukes already in my uninformed opinion.  No big deal as far as I am concerned.

We faced down the USSR who had 20,000 nukes pointed at us.  The same USSR that had murdered tens of millions like they were ants.

I don’t like Iran with the bomb, but I’m not gonna invade or start a war with Iran just because they want a few nukes.

Just like the USSR, who was a far more dangerous foe, Iran knows the consequences of using those nukes.",-8,2025-06-02 19:42:40+00:00,t1_mvn0n16,460,2025-06-02
1l1pdh8,mvnkigr,No_Talk_4836,"Someone mentioned Israel, and Israel has a policy to basically nuke several hundred million people if they’re actually invaded. Including Europe.",6,2025-06-02 20:43:42+00:00,t1_mvn7pja,145,2025-06-02
1l1pdh8,mvoaaxo,Inithis,Could you elaborate on that? Why would they attack Europeans?,3,2025-06-02 22:56:10+00:00,t1_mvnkigr,61,2025-06-02
1l1pdh8,mvoc22p,No_Talk_4836,"Samson option establishes it as an active protocol, and the European option would be retaliatory since a collapse of Israel would include inaction by Europe. 

Revenge isn’t logical, either, though I could not find anything official for that. But then the only official thing for Israel having nukes at all comes from a minister slipping.",3,2025-06-02 23:05:43+00:00,t1_mvoaaxo,338,2025-06-02
1l1pdh8,mvtfgcg,senfgurke,"Which is technically sufficient to use in a bomb, it'd just be much less efficient than using >90% HEU.",1,2025-06-03 18:37:05+00:00,t1_mvmxp6v,103,2025-06-03
1l1pdh8,mvpjrlm,SYLOH,"> The level of enrichment.

Of both the Uranium and the President.",0,2025-06-03 03:28:51+00:00,t1_mvmv319,66,2025-06-03
1l1pdh8,mvp1r94,Caezeus,"Iran had to become a member of Trumps Patreon channel first.

LIKE AND SUBSCRIBE",3,2025-06-03 01:35:33+00:00,t1_mvmqn89,80,2025-06-03
1l1pdh8,mvnvhp4,TAV63,They were supposed to be about stopping them from enrichment and being a nuclear threat. But you know TACO is the way.,3,2025-06-02 21:37:28+00:00,t1_mvmqn89,118,2025-06-02
1l1pdh8,mvq6xvh,texachusetts,Mostly Trump negotiations are not about a better deal then before but a DEAL that Trump can claim credit for as a great or better deal no matter the reality.,1,2025-06-03 06:34:44+00:00,t1_mvmqn89,157,2025-06-03
1l1pdh8,mvqk4j6,TheFirstKitten,"Your state has become an ""irrational actor"" in global politics",1,2025-06-03 08:44:42+00:00,t1_mvmqn89,62,2025-06-03
1l1pdh8,mvrbqw2,Jealous_Land9614,If Iran can give another private jet...,1,2025-06-03 12:29:52+00:00,t1_mvmqn89,39,2025-06-03
1l1pdh8,mvoiwds,Sideshow_Bob_Ross,How much money goes into Trump's pockets.,0,2025-06-02 23:43:48+00:00,t1_mvmqn89,41,2025-06-02
1l1pdh8,mvmro7s,ahenobarbus_horse,"In other words, it outlines the same deal Trump tore up in 2018 for Netanyahu. 

“Politics is the art of looking for trouble, finding it whether it exists or not, diagnosing it incorrectly, and applying the wrong remedy.” - Ernest Benn",942,2025-06-02 18:25:33+00:00,t3_1l1pdh8,235,2025-06-02
1l1pdh8,mvn7anz,Lets_Kick_Some_Ice,trees public desert judicious languid dam unwritten nose cobweb disarm,306,2025-06-02 19:40:40+00:00,t1_mvmro7s,70,2025-06-02
1l1pdh8,mvnfowm,bemenaker,A little of both. Bibi the genocidal war monger wanted it gone too.,41,2025-06-02 20:20:56+00:00,t1_mvn7anz,67,2025-06-02
1l1pdh8,mvo071n,substandardgaussian,Should we expect the US to flip on this the next time Netanyahu has Trump's ear?,14,2025-06-02 22:01:24+00:00,t1_mvnfowm,80,2025-06-02
1l1pdh8,mvo7qpi,bemenaker,History has shown donOld has sided with bibi 100% of the time,8,2025-06-02 22:42:15+00:00,t1_mvo071n,61,2025-06-02
1l1pdh8,mvp1z7b,cadeyM69,What makes Bibi a “genocidal war monger”?,-2,2025-06-03 01:36:52+00:00,t1_mvnfowm,41,2025-06-03
1l1pdh8,mvp7e9t,StupidityHurts,"I’ll give him Corrupt Exploitative Bastard War Mongerer, but I disagree with genocidal. 

We can give that one to Ben Gvir that shmuck",3,2025-06-03 02:09:22+00:00,t1_mvp1z7b,134,2025-06-03
1l1pdh8,mvnckmj,nanoray60,"This is what jimmy neutron does. Creates a problem that didn’t exist, then “fixes” it.",16,2025-06-02 20:06:09+00:00,t1_mvmro7s,86,2025-06-02
1l1pdh8,mvn2q55,SMOKE2JJ,That is amazing.,4,2025-06-02 19:18:38+00:00,t1_mvmro7s,16,2025-06-02
1l1pdh8,mvndjm5,AlgaeDonut,"This is doge's mission statement, operational guide, implementation protocol down to a T. Very apt.",4,2025-06-02 20:10:47+00:00,t1_mvmro7s,99,2025-06-02
1l1pdh8,mvoqajq,SadPanthersFan,Sounds like The Art of the Taco to me,1,2025-06-03 00:26:47+00:00,t1_mvmro7s,37,2025-06-03
1l1pdh8,mvms0st,Mudder1310,I’m almost certain the deal Trump tore up the first time around did not allow for enrichment beyond a particular industrial/medical level.,409,2025-06-02 18:27:14+00:00,t3_1l1pdh8,138,2025-06-02
1l1pdh8,mvntrmg,ItsMetheDeepState,"Which is a lot of time to renegotiate. But hey, starting over from scratch on a worse footing is the Art of the Deal.",81,2025-06-02 21:28:46+00:00,t1_mvmxyoc,117,2025-06-02
1l1pdh8,mvo2h6m,NativeMasshole,"Ironically, right around now would have been a good time to start hammering out negotiations for the end of that deal. It probably would have been much easier with an existing deal in place, too.",21,2025-06-02 22:13:32+00:00,t1_mvntrmg,195,2025-06-02
1l1pdh8,mvp4f42,TheNewGildedAge,I wonder when Trump will have this brilliant idea for a Trans-Pacific Economic Partnership (TPEP) to contain China in the Pacific. And all his supporters will cheer and complain that Democrats didn't do it already because it's so obvious.,3,2025-06-03 01:51:22+00:00,t1_mvntrmg,238,2025-06-03
1l1pdh8,mvmusgt,creativename87639,"I mean so does this one supposedly

> would allow limited low-level uranium enrichment on Iranian soil for a to-be-determined period of time

IMO this is a non headline, we were pushing for zero enrichment but that’s just not happening.",34,2025-06-02 18:40:37+00:00,t1_mvms0st,236,2025-06-02
1l1pdh8,mvn9utr,FeatherShard,It's Taco Tuesday in Iran,11,2025-06-02 19:53:00+00:00,t1_mvmusgt,25,2025-06-02
1l1pdh8,mvope6s,Ballplayerx97,There is no level that we should tolerate. We know the Iranian regime's goal is to build nuclear weapons. We know that they will not abide by the terms of the deal. It's foolish to think you can make peace with these wackjobs. It's like thinking you can work out a deal with Putin.,0,2025-06-03 00:21:26+00:00,t1_mvms0st,281,2025-06-03
1l1pdh8,mvoqiww,Mudder1310,Fair enough. The way it’s been mishandled has only made things more convoluted and beneficial to Iran.,2,2025-06-03 00:28:10+00:00,t1_mvope6s,102,2025-06-03
1l1pdh8,mvp4dzf,mfb-,An agreement that they can make reactor-grade uranium and allow external observers to watch it is better than no agreement and enrichment happening in secret.,2,2025-06-03 01:51:11+00:00,t1_mvope6s,158,2025-06-03
1l1pdh8,mvpd5zr,Ballplayerx97,As long as we all acknowledge that the agreement isn't worth the paper it's printed on. They will almost certainly continue enriching uranium to weapons grade levels in secret and will deny access. That's what they do. That's why they have nuclear infrastructure to begin with. My concern is that Americans will take an agreement at face value and let their guard down. We're already seeing this attitude amongst the isolationist crowd. It's a dangerous game to play.,3,2025-06-03 02:45:17+00:00,t1_mvp4dzf,467,2025-06-03
1l1pdh8,mvogvrp,_jump_yossarian,Yes but this deal will be better because it’s a TREMENFOUS trump deal!!!,0,2025-06-02 23:32:27+00:00,t1_mvms0st,72,2025-06-02
1l1pdh8,mvmwy8m,Scaryclouds,"We’re basically going to end up with the JCPOA, but with having allowed Iran to further mature their nuclear plan and having damaged the US’s reputation by unilaterally pulling out of a deal we spearheaded.

On the face of things that’s bad enough, but Trump/MAGA media are going to hype such a deal (if it happens) as though it’s the best thing ever… just the continuous reality distortion field around Trump. 

Feels like the Grimes episode of the Simpsons. Just we’re all Grimes and Trump is Homer 😒",153,2025-06-02 18:50:53+00:00,t3_1l1pdh8,502,2025-06-02
1l1pdh8,mvmyjqp,Otazihs,"This is what he does, tramples over established deals, calls previous administrations incompetent, waits a bit, comes up with a new ""deal"" that is worse than the previous one and then goes around spewing how he's a genius.

He does this even with deals that HE himself established! It's utter madness and mental instability.",64,2025-06-02 18:58:25+00:00,t1_mvmwy8m,324,2025-06-02
1l1pdh8,mvmzi92,Scaryclouds,Yea… and that’s obviously deeply frustrating. It’s just the extent to which the rest of the media/public plays along in this delusion is truly maddening.,18,2025-06-02 19:03:03+00:00,t1_mvmyjqp,153,2025-06-02
1l1pdh8,mvovm7z,LIONEL14JESSE,"Because he doesn’t run the country like a business, he runs it like a reality tv show. And “negotiating” is the show’s whole schtick. None of the details matter anymore, as long as you can manufacture more stories about winning bigly.",3,2025-06-03 00:58:37+00:00,t1_mvmyjqp,234,2025-06-03
1l1pdh8,mvn1xqg,The-M0untain,And then Iran will violate the deal.,-4,2025-06-02 19:14:49+00:00,t1_mvmwy8m,36,2025-06-02
1l1pdh8,mvn7xzo,BabyDog88336,"Whatever.  Just be happy Trump wants to avoid a war.  He sucks, but I will give him that.",-18,2025-06-02 19:43:48+00:00,t1_mvmwy8m,89,2025-06-02
1l1pdh8,mvo3ab0,Ok_Respond7928,Literally nothing he’s done as helped to avoid war only the opposite.,12,2025-06-02 22:17:54+00:00,t1_mvn7xzo,69,2025-06-02
1l1pdh8,mvo5y9l,BabyDog88336,Trump is going to do a chickenshit deal with Iran that let’s them enrich Uranium.  Mark my words.  The neocons who want yet another war in the Middle East will howl in protest.,-2,2025-06-02 22:32:25+00:00,t1_mvo3ab0,176,2025-06-02
1l1pdh8,mvrff1k,Jealous_Land9614,"He will just copy/paste Obama deal he destroyed... to call it his own, later.

 

 Fine by me, if only americans would read more. They would notice how infantile this whole fiasco is.",1,2025-06-03 12:52:07+00:00,t1_mvo5y9l,183,2025-06-03
1l1pdh8,mvnes7y,Scaryclouds,I guess? Until he blunders into one through his obnoxious bluster.,3,2025-06-02 20:16:40+00:00,t1_mvn7xzo,66,2025-06-02
1l1pdh8,mvn78gb,Blochamolesauce,Awww Ben Afflec splooge,16,2025-06-02 19:40:22+00:00,t1_mvn3l0o,23,2025-06-02
1l1pdh8,mvn4ipv,boltsnuts,That was one of the best episodes.,10,2025-06-02 19:27:18+00:00,t1_mvn1rmm,34,2025-06-02
1l1pdh8,mvpm7le,TheFlyingBoxcar,My name ees HEN-nifer .. HLO-pess. AnIliketacosanburreeeetos!,2,2025-06-03 03:45:53+00:00,t1_mvn1rmm,61,2025-06-03
1l1pdh8,mvo26kg,ToxicBTCMaximalist,Burrito burrito.,9,2025-06-02 22:11:56+00:00,t1_mvms39u,16,2025-06-02
1l1pdh8,mvp999d,billyjack669,"Donald Pollo’s, can I TACO your order?",3,2025-06-03 02:20:51+00:00,t1_mvms39u,38,2025-06-03
1l1pdh8,mvn87uv,BabyDog88336,Better than a war with Iran…,-10,2025-06-02 19:45:08+00:00,t1_mvms39u,28,2025-06-02
1l1pdh8,mvoqzlx,Mazon_Del,"Good god you people flipflop faster than footwear on a beach.

Last week it was ""You can't let someone like Iran get the bomb! Everything's on the table!"", and now that TACO struck again, you're pretending that returning to Obama's deal isn't the opposite of what you were foaming at the mouth over.",6,2025-06-03 00:30:59+00:00,t1_mvn87uv,299,2025-06-03
1l1pdh8,mvn330f,BiffChildFromBangor,WACO TACO strikes again.,63,2025-06-02 19:20:20+00:00,t3_1l1pdh8,24,2025-06-02
1l1pdh8,mvnlh0x,xxearvinxx,Could I get a breakdown on the WACO part?,7,2025-06-02 20:48:14+00:00,t1_mvn330f,41,2025-06-02
1l1pdh8,mvnvks5,Macsfamousmacnchez,Worst American cunt obviously,21,2025-06-02 21:37:54+00:00,t1_mvnlh0x,29,2025-06-02
1l1pdh8,mvop6jz,34048615,I also would like to know,2,2025-06-03 00:20:10+00:00,t1_mvnlh0x,25,2025-06-03
1l1pdh8,mvnez0m,BigMax,"After all this time, when Trump cancelled the first Iran deal just because Obama negotiated it... We'll have gone 8+ years without a deal, all to end up with one that's probably not even as good as the original deal.

All because Trump is stupid and self centered. MASSIVE world policy decided based on a toddler mentality. And yet his toddler mentality supporters love it.",34,2025-06-02 20:17:33+00:00,t3_1l1pdh8,373,2025-06-02
1l1pdh8,mvrfu5s,Jealous_Land9614,"Be patient, he has Obama derangement syndrome...",1,2025-06-03 12:54:32+00:00,t1_mvmyagc,48,2025-06-03
1l1pdh8,mvn22xy,laxfreeze,"Last week wasn’t it “there’s no way we are going to allow you to enrich uranium” ? I mean, I’m so lost",8,2025-06-02 19:15:31+00:00,t3_1l1pdh8,102,2025-06-02
1l1pdh8,mvohri6,bard329,"So we pulled out of a deal that would block iran from enriching any uranium and are now negotiating a deal that would allow them to enrich some uranium.

Is this the art of the deal?",8,2025-06-02 23:37:26+00:00,t3_1l1pdh8,182,2025-06-02
1l1pdh8,mvonbzn,TauCabalander,Trivia: 'The Art of the Deal' was ghostwritten by Tony Schwartz.,2,2025-06-03 00:09:14+00:00,t1_mvohri6,64,2025-06-03
1l1pdh8,mvrg1qm,Jealous_Land9614,Maybe Israelis shoul not have lobbied against Obama deal...now theres no better option.,1,2025-06-03 12:55:46+00:00,t1_mvohri6,87,2025-06-03
1l1pdh8,mvogpfv,_jump_yossarian,Sounds a lot like the Obama deal that trump shit all over. I’m guessing this will be a better deal …. for Iran.,6,2025-06-02 23:31:28+00:00,t3_1l1pdh8,111,2025-06-02
1l1pdh8,mvpgpo7,_Machine_Gun,"Apparently Trump changed his mind again:

[Trump claims U.S. won't let Iran enrich uranium under nuclear deal](

>Trump's claim contradicts the proposal his envoy Steve Witkoff made to Iran on Saturday, the details of which were reported by Axios on Monday.",6,2025-06-03 03:08:11+00:00,t3_1l1pdh8,257,2025-06-03
