post_id,comment_id,author,body,score,created_utc,parent_id,text_length,date
1l7x61i,mx05ejx,SpiritedEclair,"Oh wow, look at the president going back on everything! What a coward.",1482,2025-06-10 12:17:34+00:00,t3_1l7x61i,70,2025-06-10
1l7x61i,mx06j9a,Roselily808,He isn't called TACO-Trump for nothing.,485,2025-06-10 12:24:43+00:00,t1_mx05ejx,39,2025-06-10
1l7x61i,mx0lkd9,Leezeebub,Trump always chickens out trump?,36,2025-06-10 13:49:44+00:00,t1_mx06j9a,32,2025-06-10
1l7x61i,mxbpbbo,OkInterest3109,"Trump playing chicken with himself.

Who's going to chicken out first? Trump or Trump? Either way, everyone loses.",2,2025-06-12 04:03:12+00:00,t1_mx0lkd9,114,2025-06-12
1l7x61i,mx0tmp7,Anakin_Sandwalker,Maybe it should be Trump TACO?,-8,2025-06-10 14:29:58+00:00,t1_mx0lkd9,30,2025-06-10
1l7x61i,mx1124u,Leezeebub,Trump trump always chickens out?,13,2025-06-10 15:05:39+00:00,t1_mx0tmp7,32,2025-06-10
1l7x61i,mx1tlc1,Noughmad,"There is one thing he's consistent on, and that is Russia. Everything else changes every day.",25,2025-06-10 17:19:09+00:00,t1_mx05ejx,93,2025-06-10
1l7x61i,mx0i30o,BoosterRead78,Oh yes ending “all wars” some times I wish every time someone repeated a Trump lie they would get smacked out if no where.,25,2025-06-10 13:31:11+00:00,t1_mx05ejx,122,2025-06-10
1l7x61i,mx19mc0,lancelongstiff,"Well there are hundreds, perhaps even a few thousand protesters in L.A. right now and he still hasn't sent in the Air Force to nuke the city. That's how important pacifism is to him.",11,2025-06-10 15:46:06+00:00,t1_mx0i30o,182,2025-06-10
1l7x61i,mx2j6p5,kmookie,"We’ll reports are, they’re just sitting there without any means of food, water or orders to do anything. So even the people meant to help a situation get to suffer.",4,2025-06-10 19:18:03+00:00,t1_mx19mc0,164,2025-06-10
1l7x61i,mx516za,tokiesenpai,The United Stated is going through a thing right now. Continue making your drones and gorilla fing Russia until we get our crap together.,3,2025-06-11 03:27:06+00:00,t1_mx05ejx,137,2025-06-11
1l7x61i,mx60j8e,using2stars,It’s because of the drone attacks on Russia.,1,2025-06-11 08:31:55+00:00,t1_mx05ejx,44,2025-06-11
1l7x61i,mx08r30,Future-Suit6497,Boggles the mind that Trump was voted in AGAIN. I mean what the flying fuck is wrong with that country?,625,2025-06-10 12:38:17+00:00,t3_1l7x61i,103,2025-06-10
1l7x61i,mx0bi1r,DiarrheaMonkey-,"And a bunch of people stupid enough to vote against their own self-interest, and against the rest of humanity, based on the dumbest level of propaganda.

As an American, I say this: more than 50% of American voters are worse than idiotic.",248,2025-06-10 12:54:26+00:00,t1_mx0asbe,238,2025-06-10
1l7x61i,mx21l5a,Freakjob_003,"“Think of how stupid the average person is, and realize half of them are stupider than that.”
― George Carlin",20,2025-06-10 17:55:24+00:00,t1_mx0bi1r,109,2025-06-10
1l7x61i,mx55ufa,bulking_on_broccoli,Try a full 1/3. A 3rd of our electorate sat out the election.,1,2025-06-11 03:59:38+00:00,t1_mx0bs5d,61,2025-06-11
1l7x61i,mx0f84t,BarfingOnMyFace,I’m going with 70%. I don’t discriminate against idiots in other parties.,16,2025-06-10 13:15:32+00:00,t1_mx0bi1r,73,2025-06-10
1l7x61i,mx2xf7g,Vertigalactic,"And because of our abysmally underfunded education system, we'll stay stupid",7,2025-06-10 20:25:25+00:00,t1_mx0bi1r,76,2025-06-10
1l7x61i,mx0qbw5,Relevant-Doctor187,Many vote for boobs or treat it like a sports team. So sick of it.,11,2025-06-10 14:13:55+00:00,t1_mx0bi1r,66,2025-06-10
1l7x61i,mx0s979,DiarrheaMonkey-,"Agreed. John Kerry; questionable Vietnam heroism, total centrist. Good luck winning on that guy. That pick cost the nation and the world so much. Gore? Same diff.",-11,2025-06-10 14:23:19+00:00,t1_mx0qbw5,162,2025-06-10
1l7x61i,mx3hdfo,Stravven,And at least a third are idiotic by not voting.,3,2025-06-10 22:02:47+00:00,t1_mx0bi1r,47,2025-06-10
1l7x61i,mx18p3e,izwald88,"Yeah, our culture has really suffered. Maybe it's just me, but the overall sense that everyone hates everyone else is palpable. We are all in it for ourselves, and everyone else is in our way. 

And I propagate that hate, too. As a straight white male liberal, I can't help but think that everyone I see that looks like me is probably a racist piece of shit. Statistically, I'm probably not wrong.",4,2025-06-10 15:41:50+00:00,t1_mx0bi1r,397,2025-06-10
1l7x61i,mx23h04,natasevres,"Sadly it lines up perfectly:

On average, 79% of U.S. adults nationwide are literate in 2024.

21% of adults in the US are illiterate in 2024.

54% of adults have a literacy below a 6th-grade level (20% are below 5th-grade level).

Low levels of literacy costs the US up to 2.2 trillion per year.",5,2025-06-10 18:04:03+00:00,t1_mx0bi1r,296,2025-06-10
1l7x61i,mx25q5n,TobysGrundlee,We have a very high population of immigrants/English language learners. Simple literacy stats don't really say much.,2,2025-06-10 18:14:30+00:00,t1_mx23h04,116,2025-06-10
1l7x61i,mx2qqak,Popoatwork,Note that literacy does not require literacy in English.,3,2025-06-10 19:54:14+00:00,t1_mx25q5n,56,2025-06-10
1l7x61i,mx2ah5y,natasevres,"Im sorry - but we have immigration everywhere. The Numbers in the US is actually even worse then in the Native countries people are moving from.

The US is not unique for having immigration, id even argue that Europe in many ways have taken on larger populations than the US in terms of illiteracy:

”The sizes of the unauthorized immigrant populations in Europe and the U.S. have trended in opposite directions in recent years. Europe’s grew from between 3.0 million and 3.7 million in 2014 to a range of 3.9 million to 4.8 million in 2017. But in the U.S., the size of the unauthorized immigrant population has decreased, from between 10.9 million and 11.3 million in 2014 to a range of 10.3 million to 10.7 million in 2017. While Europe’s increase stems in part from its recent surge of asylum seekers from Syria, Afghanistan and other countries, the U.S. decline is largely due to a decrease in the number of Mexican unauthorized immigrants living in the country.”

The real cause in the US is a failing education system which in part has lowered literacy for over 30 years.",5,2025-06-10 18:36:51+00:00,t1_mx25q5n,1078,2025-06-10
1l7x61i,mx2clw6,TobysGrundlee,"A) Europe isn't a country B) ""Unauthorized immigrants"" are not the only immigrants to consider and C) You make no comparison of literacy rates in Europe. 

You clearly have an agenda here.

Don't bother with any more of you biased half interpretation of the facts, I won't be reading it.",-7,2025-06-10 18:46:58+00:00,t1_mx2ah5y,287,2025-06-10
1l7x61i,mx2e7ai,natasevres,"The US is a gathering of states - The EU is a gathering of state countries.

Your reasoning pretty much tells me you are part of the 54%.",4,2025-06-10 18:54:24+00:00,t1_mx2clw6,137,2025-06-10
1l7x61i,mx2lp4d,Tandittor,That's a derp stupid rationale and you know it.,-4,2025-06-10 19:30:06+00:00,t1_mx2e7ai,47,2025-06-10
1l7x61i,mx2m1tp,natasevres,"Which bit?

That immigration is the reason american illiteracy amongst americans is so high?

Yes, this is very silly.",4,2025-06-10 19:31:48+00:00,t1_mx2lp4d,118,2025-06-10
1l7x61i,mx5xhto,Pretend-Relative3631,Harvard has a whole ass study confirming this fact,1,2025-06-11 08:01:13+00:00,t1_mx0bi1r,50,2025-06-11
1l7x61i,mx0id7o,BoosterRead78,"Right I mean many said that Trump campaigned on what most people want. Which is bias, racism and authoritarianism. Which is why they said democrats lost to him. Yet when you look at everything across the board. GOP only got their majority through slim margins.",-1,2025-06-10 13:32:44+00:00,t1_mx0bi1r,260,2025-06-10
1l7x61i,mxbpub5,OkInterest3109,Another chunk was apathetic enough to it that they didn't vote despite this being round 2.,1,2025-06-12 04:07:08+00:00,t1_mx0owvz,90,2025-06-12
1l7x61i,mx1dq7q,juicadone,YUP! Dumb as shite.,0,2025-06-10 16:05:11+00:00,t1_mx0bi1r,19,2025-06-10
1l7x61i,mx0eamj,Dvillustrations,"And this is a fine example of how you've ended up with Trump...looking down at everyone not politically aligned with you, pushing again and again that they're ""dumb/bigoted/stupid"" etc. The moral grandstanding of the left is a direct cause of pushing significant amounts of American voters either to not vote or to vote for Trump.
Obviously though Americans won't learn from this mistake, just like you exemplify here by refusing to analyze what brought you to this situation.
Good luck with trumps successors🫡",-28,2025-06-10 13:10:22+00:00,t1_mx0bi1r,510,2025-06-10
1l7x61i,mx0gxwe,acityonthemoon,"Anyone who looks at what Trump and his Conservative party are doing and says 'Yes, that's for me!' is someone who deserves to be looked down on. Actions have consequences, why should anybody ever trust a Republican's opinion on anything?",11,2025-06-10 13:24:58+00:00,t1_mx0eamj,237,2025-06-10
1l7x61i,mx0irte,Dvillustrations,"And once more, you prove my point by immediately absolving yourself of any blame and legitimizing dehumanization of ""the other side""
Your country is a two party system
The reality is that many people (irregardless of their opinion about Republicans) looked at the Democratic party and said, ""No, I don't agree with what they say or push"" and abstained from voting.
Actions have consequences and absolving yourselves of any wrongdoing and completely shifting the blame to the ""other side"" while willfully ignoring any criticism because of an unfounded belief of complete moral superiority is exactly how you got into this mess.
Unless democrats will learn from their mistakes, you're going to have a long line of leaders like Trump.
I grew up in NYC as a child...all of what you had and what you built, you took for granted",-20,2025-06-10 13:34:58+00:00,t1_mx0gxwe,822,2025-06-10
1l7x61i,mx0j5jb,acityonthemoon,go 'bothsidessame' somebody else please,13,2025-06-10 13:37:01+00:00,t1_mx0irte,39,2025-06-10
1l7x61i,mx0gkcf,Pikalover10,"Awww, did the words hurt, snowflake? To act like the left is the only one throwing insults around is a choice.",10,2025-06-10 13:22:55+00:00,t1_mx0eamj,110,2025-06-10
1l7x61i,mx0hf4j,Dvillustrations,"Thanks for proving my point?
I'm not saying the American right is any better.
I'm saying all of you are complete and utter morons for allowing corrupt politicians to polarize you and then going so far as to believe you're morally superior because you let them polarize you...
But sure, immediately getting defensive and shifting blame while attempting to belittle anybody disagreeing with you definitely shows how much smarter and intelligent you are over the ""other side""
👍",-13,2025-06-10 13:27:35+00:00,t1_mx0gkcf,474,2025-06-10
1l7x61i,mx0iwrh,Pikalover10,"My word choice was explicitly done to reference the exact insult that the right has been throwing around for decades. It obviously flew over your head and that’s okay, it’s my fault to assume everyone would catch on to that.

American politics are a shit show, and are designed in such a way that the corrupt politicians can legally do things to keep the common man poor, uneducated, and unable to actually change anything together. Every single person in American politics is subscribed to this because it keeps them rich.

I agree that the level of extreme polarization here is disgusting. Most people’s politics would actually be extremely central if they were willing to talk to each other and figure it out. Most don’t and most don’t care, because in reality it doesn’t matter, the billionaires are still in charge and will just lobby and pay their way through everything.

So, since we the people can’t actually do anything meaningful to bring about meaningful change, people all across the country decide to fuel unrest by attacking the people they can that they will immediately get a rise or results from.",2,2025-06-10 13:35:43+00:00,t1_mx0hf4j,1114,2025-06-10
1l7x61i,mx0l9gf,Dvillustrations,"Your word choice perfectly exemplifies my point.
You ""the people"" have always been capable of meaningful change, or have you forgotten the accomplishments of the civil rights movement?
You the people prefer to shift blame and absolve yourselves of responsibility rather than enduring hardship",-5,2025-06-10 13:48:10+00:00,t1_mx0iwrh,292,2025-06-10
1l7x61i,mx0mony,Pikalover10,"We were making change and progress under Obama as president, which wasn’t long ago, so to act like you have to go all the way back to the 50s to find evidence of the country’s people working together is disingenuous.

Out of curiosity because you yourself act very high and mighty in your speech, what would you do?",3,2025-06-10 13:55:30+00:00,t1_mx0l9gf,315,2025-06-10
1l7x61i,mx0irp6,DiarrheaMonkey-,"It really has more to do with a first-past the post electoral system as opposed to proportional representation on any level. It comes down to people voting for what they consider the lesser of two evils.

This leads to factionalism over pragmatism.

Campaign laws reflect that.

The end result is poor people voting for rich people, against their self-interest and has afflicted many nations as badly or worse over the course of history.

You paint it as some simple shortcoming of Americans, but it was centuries in the making.",1,2025-06-10 13:34:57+00:00,t1_mx0eamj,528,2025-06-10
1l7x61i,mx0kpcx,Dvillustrations,"America has always had a long history of facing corruption from within, since before, even Tammany hall, and historically, you fought corruption with either the pen, the sword or both.
You allowed your leaders to viciously polarize the population, see the other party as evil and stupid. You voted corrupt leaders into power, letting them distract you with non-issues. You let them steal your money, your rights, and your future while you closed your eyes, believing that choosing what you saw as the lesser evil would lead to a better future.
It is absolutely and completely the fault of the American public.
There was no military coup.
No bloody revolt.
No military junta hanging dissidents in the streets.
No secret police dragging of professors to work camps.
YOU, ALL OF YOU, VOTED AND ALLOWED THESE PEOPLE INTO POWER.
Take responsibility and fix your fucking country instead of crying like entitled children",1,2025-06-10 13:45:15+00:00,t1_mx0irp6,913,2025-06-10
1l7x61i,mx0m9it,DiarrheaMonkey-,"I'm not even going to read that long angry, meaningless diatribe, let alone dignify it with a response.",0,2025-06-10 13:53:19+00:00,t1_mx0kpcx,103,2025-06-10
1l7x61i,mx0mgq8,Dvillustrations,"👍
Enjoy the reality you've created",4,2025-06-10 13:54:22+00:00,t1_mx0m9it,34,2025-06-10
1l7x61i,mx0n0rq,DiarrheaMonkey-,"Yeah, I'm the one twisting facts to create a false backstory for reality.

Blocked",2,2025-06-10 13:57:13+00:00,t1_mx0mgq8,82,2025-06-10
1l7x61i,mx0wxxh,Jealous_Breakfast996,Media owned by billionaires. Investigative journalism is pretty much dead,11,2025-06-10 14:45:55+00:00,t1_mx0asbe,73,2025-06-10
1l7x61i,mx0jhj4,followtharulez,Too many Dems stayed home on Nov 4th...!,7,2025-06-10 13:38:49+00:00,t1_mx0asbe,40,2025-06-10
1l7x61i,mx0s2ky,3490goat,Don’t forget a compliant media who is happy to profit off the chaos,6,2025-06-10 14:22:27+00:00,t1_mx0asbe,67,2025-06-10
1l7x61i,mx3ma19,General-Adminium,a two party system who both play for the same time while neither actually represent the people anymore. It's one big joke it seems,2,2025-06-10 22:29:14+00:00,t1_mx0asbe,130,2025-06-10
1l7x61i,mx10hal,JoeHatesFanFiction,This. I would vote for anybody who was serious about massive voting reform. The system is horribly broken and in desperate need of fixing,4,2025-06-10 15:02:50+00:00,t1_mx0asbe,137,2025-06-10
1l7x61i,mx0lqqo,Syscrush,Literally none of that is relevant. The voters chose Trump even after seeing how disastrously terrible he was the first time through.,3,2025-06-10 13:50:39+00:00,t1_mx0asbe,133,2025-06-10
1l7x61i,mx49nf8,Extreme_Put_913,"You can also add Biden running a 2nd term, Biden dropping out 100 days before the election which basically crippled Kamala. Kamala saying she won't act differently than Biden (Point here being is right or wrong people were tired of Biden and she said she'd act no different)",1,2025-06-11 00:40:27+00:00,t1_mx0asbe,274,2025-06-11
1l7x61i,mx4jdvn,GovtLegitimacy,"Go damn it! Laws are just ink on paper without enforcement. The reason we are where we are is due to the US electorate. There is NO EXCUSE, stop making them. If we are going to fix this, we must accurately identify the issue. 

We have a critical mass of the electorate that supports a 34 time felon who tried overturning democracy, etc. and another critical mass that decided democracy wasn't worth their time to even cast a vote. That is the problem.

The primary critique of democracy since antiquity is that an ignorant and/or pathetic democracy will always fail. Indeed, it is on the People to maintain and preserve self governance and government legitimacy. 

The only excuse for the electorate is that they are victims of generational degradation of civics education and/or victims of even the most ridiculous disinformation. (Trump recently posted that Biden was a robot, etc.)

A free people couldn't ask for an easier tyrant to defeat - one whose intentions are open and obvious, one with a public-facing record of fraud, criminality and immorality, one who openly befriends other tyrants and attacks elected allies leaders.

Stop trying to invent excuses - this is all on Us The People, and it is all on Us The People to fix.",1,2025-06-11 01:37:11+00:00,t1_mx0asbe,1236,2025-06-11
1l7x61i,mx32jf5,Mobile-Base7387,he won the popular vote tho,0,2025-06-10 20:49:17+00:00,t1_mx0asbe,27,2025-06-10
1l7x61i,mx0ib0h,DaveVdE,"He won the popular vote, so no BS on electoral college, please.",-4,2025-06-10 13:32:25+00:00,t1_mx0asbe,63,2025-06-10
1l7x61i,mx0bfpf,BOHIFOBRE,Hatred and a 50yr attack on education that's finally paying off.,40,2025-06-10 12:54:03+00:00,t1_mx08r30,64,2025-06-10
1l7x61i,mx0glfp,treachpreacher,"Something was funky. It follows their usual means of action, saying the other side did something and then immediately doing that thing. The amount of tendrils they put into all of our data immediately afterwards doesn't help. Neither does cutting out all checks and balances on the new king",9,2025-06-10 13:23:05+00:00,t1_mx08r30,290,2025-06-10
1l7x61i,mx1snai,SuperCiuppa_dos,"It’s absolutely crazy what’s happening over there, they’re essentially sleeping walking into civil war because this absolute mad man, made up a whole bunch of nonexistent crises and is now dumping gallons of gasoline onto the flames that he sparked…",7,2025-06-10 17:14:51+00:00,t1_mx08r30,249,2025-06-10
1l7x61i,mx0qt3u,Nigilij,They are into competitive “fuch thy neighbor” mindset,3,2025-06-10 14:16:15+00:00,t1_mx08r30,53,2025-06-10
1l7x61i,mx1azd2,666Blonded,It's possible they rigged some machines,6,2025-06-10 15:52:24+00:00,t1_mx08r30,39,2025-06-10
1l7x61i,mx0hp3z,Normal-Corgi2033,I mean we have Trump on the record talking about how well Elmo Muskovy knows those voting machines so that's super sus,6,2025-06-10 13:29:06+00:00,t1_mx08r30,118,2025-06-10
1l7x61i,mx1f4cq,animoscity,"Considering they have reports of uncounted votes and changed votes in multiple locations, which are now just looking into it. Yeah, he wasnt voted in, he cheated. Lets see if america does anything, but doubt it.",7,2025-06-10 16:11:47+00:00,t1_mx08r30,211,2025-06-10
1l7x61i,mx2iooc,MyHusbandIsGayImNot,The average American is so politically illiterate they couldn't even tell you why Trump was impeached.,2,2025-06-10 19:15:40+00:00,t1_mx08r30,102,2025-06-10
1l7x61i,mx1jrqh,KingDaDeDo,"American here. there's a lot wrong here. Ever since COVID happened, our country has been a complete mess. the 2024 election showed that a lot, and i mean, a lot of people here are either uneducated, are racist/sexist/homophobic, or simply don't care.

i think we can break our population into thirds. 33% are trump maga supporters, whether they know just how corrupt they are, or have been brainwashed into it over the past decade since his first presidency. 33% just flat out dont care or think it wont effect them. and 33% of us actually do care, are educated, and know just how awful he and his supporters are.

unfortunately, the democrats really dropped the ball for the 2024 election. yes, it should have been complete common sense to not vote for trump and vote for harris. but too many people are captivated by trumps character and democrats did not build up anyone properly to challenge him. the democrats need to be build someone up now to take back the presidency in 2028. we can hope.",1,2025-06-10 16:33:47+00:00,t1_mx08r30,996,2025-06-10
1l7x61i,mx1h9ha,RSMeansPimp,"I will tell you. Because I, like the rest of my family, am too fucking stupid to understand how we got here. That’s it. We are wildly uneducated as a country. So it’s just stupid people making stupid decisions all the time at every level. Hope this helps.",1,2025-06-10 16:21:56+00:00,t1_mx08r30,255,2025-06-10
1l7x61i,mx4ad7w,Butterflyteal61,"Haven't you heard? 
Elon helped him cheat.",1,2025-06-11 00:44:33+00:00,t1_mx08r30,42,2025-06-11
1l7x61i,mx0iq5c,EntrepreneurFunny469,"Inflation. People blamed Biden. Also, democrats tried to run a corpse for president, then just ran the vice president who was also unpopular and couldn’t win her own primary against Biden (a known corpse). 

The “opposition” party in America is the most enabling and complacent opposition party outside of China or North Korea.",-2,2025-06-10 13:34:43+00:00,t1_mx08r30,327,2025-06-10
1l7x61i,mx1kys5,WackyWarrior,He wasn't voted in a again. He lost the election. www.electiontruthalliance.org,-2,2025-06-10 16:39:33+00:00,t1_mx08r30,79,2025-06-10
1l7x61i,mx0gbiv,ThePickleConnoisseur,"I mean when the other side has an unpopular candidate and then hotswaps for an even less popular but younger one at the end of the race while many people felt alienated, this is what you get. Which is crazy cause if Kamala said she’d legalize weed it might have been a landslide victory for her",-6,2025-06-10 13:21:34+00:00,t1_mx08r30,294,2025-06-10
1l7x61i,mx4a5l0,SmurfsNeverDie,The democrats had a chance to have a primary and decided it was worth letting biden or kamala lose to trump instead.,0,2025-06-11 00:43:20+00:00,t1_mx08r30,116,2025-06-11
1l7x61i,mx0x6w4,Sonny1x,Speaks more of the democrats that managed to lose to him than it speak for Trump himself.,-8,2025-06-10 14:47:06+00:00,t1_mx08r30,89,2025-06-10
1l7x61i,mx11r9m,Future-Suit6497,"I agree with you that the Democrats are completely incompetent.

But that doesn't excuse anyone voting for trump. How stupid do you have to be?",9,2025-06-10 15:09:00+00:00,t1_mx0x6w4,143,2025-06-10
1l7x61i,mx1mqzm,Sonny1x,"> How stupid do you have to be?

Doesn't matter? If someone is so ""stupid"", then it should be easy to get them to vote for you?

Everyone is free to their opinion and you'll never get a good political landscape in the US by calling people stupid or dumb. Just change their mind or be a better alternative...",-7,2025-06-10 16:47:58+00:00,t1_mx11r9m,307,2025-06-10
1l7x61i,mx1t0o0,snatchenvy,"> If someone is so ""stupid"", then it should be easy to get them to vote for you?

That is Trump's base. When you insanely overpromise and claim to be the best at everything... it is the stupid that fall for that.",4,2025-06-10 17:16:33+00:00,t1_mx1mqzm,212,2025-06-10
1l7x61i,mx306kp,Sonny1x,"> That is Trump's base. When you insanely overpromise and claim to be the best at everything... it is the stupid that fall for that.

And it's the opponents fault to lose to a fake politician, in this case Trump. Don't blame the voters or Trump, blame the person who couldn't manage to beat a crook...

You're going to convince no one to vote Democrat by calling them stupid or dumb, or invalidate their opinions.",1,2025-06-10 20:38:18+00:00,t1_mx1t0o0,413,2025-06-10
1l7x61i,mx230kk,SadCicada9494,"It took a catastrophic debate for democrats to throw out Biden, and replace him with a hollow woman nobody asked for that had nothing to ask for besides not being Donald Trump.

Economy was messed up. People were pissed because illegal aliens kept getting free hotel rooms and prepaid credit cards while the average citizen needed 2 jobs just to pay their rent. Trump promised to fix that and people said ""what the hell, he can't to worse than Biden""... but look where we are now.",-2,2025-06-10 18:01:56+00:00,t1_mx08r30,480,2025-06-10
1l7x61i,mx29xwm,Seattlext,"The economy was not messed up under Biden. He largely resolved the inflation crisis created by COVID and Trump’s inaction. Unemployment was the lowest in decades, CPI was decreasing, and above all, countries wanted to trade with the US.

This is all Republican propaganda that you are spewing. Illegal immigrants are not an issue, it’s a manufactured crisis to blame minorities for Republican governance incompetence.",2,2025-06-10 18:34:19+00:00,t1_mx230kk,417,2025-06-10
1l7x61i,mx0flqs,Probolone,Trump is a shithead and betraying the united states,97,2025-06-10 13:17:38+00:00,t3_1l7x61i,51,2025-06-10
1l7x61i,mx1kx8c,giantrhino,"CANCEL THE MINERAL DEAL! After the war, fuck the deal. If we haven't upheld our side of the bargain, why would you uphold yours?",50,2025-06-10 16:39:20+00:00,t3_1l7x61i,128,2025-06-10
1l7x61i,mx64wvc,Prus1s,"The mineral deal is only based on military support provided by US no?! Without it, there is no deal at all 😄",4,2025-06-11 09:16:35+00:00,t1_mx1kx8c,108,2025-06-11
1l7x61i,mx05j92,Tadpoleonicwars,"""Middle East"" is pretty broad. 

Israel? Saudi Arabia? Qatar?",117,2025-06-10 12:18:25+00:00,t3_1l7x61i,61,2025-06-10
1l7x61i,mx06lo0,zapreon,"American forces in the Middle East: 

Israel no longer uses any air defenses that Ukraine also uses so would make little sense",136,2025-06-10 12:25:07+00:00,t1_mx05j92,126,2025-06-10
