post_id,comment_id,author,body,score,created_utc,parent_id,text_length,date
1kk1mjl,mrr327f,kindagoodatthis,The houthis can shoot at them,-3,2025-05-11 14:16:55+00:00,t1_mrr2eui,29,2025-05-11
1kk1mjl,mrr19k6,Yaguajay,I wonder if and why Iran can’t purchase a bomb from the Islamists in Pakistan. Maybe with the growing religious commitment in Karachi this is a dangerous possibility.,2,2025-05-11 14:06:32+00:00,t3_1kk1mjl,166,2025-05-11
1kk1mjl,mrr4sxz,The-M0untain,Pakistan is Sunni and Iran is Shia. They hate each other.,12,2025-05-11 14:26:40+00:00,t1_mrr19k6,57,2025-05-11
1kk1mjl,mrre634,Yaguajay,"Well , I guess we are lucky on this one.",5,2025-05-11 15:17:08+00:00,t1_mrr4sxz,40,2025-05-11
1kjzcxx,mrql5mb,Zieprus_,The existence of what Russia is doing to Ukraine means you can not blame everyone wanting nukes. Such a terrible situation we have all put ourselves in.,79,2025-05-11 12:19:51+00:00,t3_1kjzcxx,152,2025-05-11
1kjzcxx,mrqqcqz,Just-Sale-7015,"There was Libya before that. Probably a scenario that Iran's leadership fears more than having some of its territories annexed by neighbors.

>

>Partially in response to Washington’s war that ousted Iraqi dictator Saddam Hussein in the spring of 2003, ostensibly because of a threat posed by Baghdad’s “weapons of mass destruction,” Libyan leader Muammar el-Qaddafi seemed to capitulate regarding such matters. He signed the Nuclear Nonproliferation Treaty in December of that year and agreed to abandon his country’s embryonic nuclear program. In exchange, the United States and its allies lifted economic sanctions and pledged that they no longer sought to isolate Libya. Qaddafi was welcomed back into the international community once he relinquished his nuclear ambitions.

>That reconciliation lasted less than a decade. When one of the periodic domestic revolts against Qaddafi’s rule erupted again in 2011, Washington and its NATO partners argued that a humanitarian catastrophe was imminent (despite meager evidence, and initiated a military intervention. It soon became apparent that the official justification to protect innocent civilians was a cynical pretext, and that another regime-change war was underway. The Western powers launched devastating air strikes and cruise-missile attacks against Libyan government forces. NATO also armed rebel units and assisted the insurgency in other ways.

>Although all previous revolts had fizzled, extensive Western military involvement produced a very different result this time. The insurgents not only overthrew Qaddafi, they captured, tortured and executed him in an especially grisly fashion.

>North Korea promptly cited the Libya episode as a reason why it needed a deterrent capability—a point that Pyongyang has reiterated several times in the years since Muammar el-Qaddafi ouster. Even [some U.S. officials concede]( that the Libya episode convinced North Korean leaders that nuclear weapons were necessary for regime survival.

>

[",26,2025-05-11 12:57:10+00:00,t1_mrql5mb,1998,2025-05-11
1kjzcxx,mrt5iir,Stupalski,"Yes and in the past few months Israel has repeatedly kept insisting on ""the Libya model"" when describing any type of deal with Iran. Literally saying the thing which will most effectively push Iran towards wanting a nuke.",4,2025-05-11 20:58:24+00:00,t1_mrql5mb,221,2025-05-11
1kjzcxx,mrtjfs7,MaximumDepression17,As a Canadian I can't believe we aren't trying to create some of our own for protection when our neighbor is clearly fucked in the head.,1,2025-05-11 22:17:45+00:00,t1_mrr52wf,136,2025-05-11
1kjzcxx,mrulngx,CircuitousCarbons70,We have maple syrup barrels.,3,2025-05-12 02:21:04+00:00,t1_mrtnilx,28,2025-05-12
1kjzcxx,mrtnx3b,MaximumDepression17,"We should either develop our own, or turn to Europe and try to make a deal. If there's one thing the US has shown us, it's to not trust them or count on them.

Ultimately our neighbor is extremely unstable and can't be trusted. The only way to defend ourselves is for them to know that an invasion isn't possible without massive casualties in major cities. It's pretty much the only effective deterrent. We obviously wouldn't stand a chance in a conventional war.",1,2025-05-11 22:45:23+00:00,t1_mrtnilx,463,2025-05-11
1kjzcxx,mrqxg55,PsychLegalMind,"In the immediate aftermath of WW II, Russia \[then USSR\] joined the U.S. Club, followed the U.K France and China. Thereafter came India, Pakistan Israel and North Korea. The first group of countries wanted to limit the expansion, but those who wanted it acquired it regardless of the threats of sanctions. Some managed to keep it a secret until actual testing. 

Will there be another one somewhere joining the Club, undoubtedly! Many others, however, at this time have decided not to, they may well change their minds.",6,2025-05-11 13:43:30+00:00,t3_1kjzcxx,520,2025-05-11
1kjzcxx,mru7efn,funnylib,"Iran is backed into a corner, its influence over the region has been blown asunder. Assad was overthrown, Hezbollah was neutered by Isreal and Lebanon now has an anti Hezbollah president, and the Houthis have been bombed to shot by America.",4,2025-05-12 00:48:52+00:00,t3_1kjzcxx,240,2025-05-12
1kjzcxx,mrr1x6k,alexredditauto,"The only countries allowed to have nukes are countries that have nukes, so you can understand why they would be after them.",13,2025-05-11 14:10:19+00:00,t3_1kjzcxx,123,2025-05-11
1kjzcxx,mrtdm9d,Icy-Blueberry2032,India/Pakistan deescalated in a week..,3,2025-05-11 21:43:50+00:00,t1_mrqn1a8,38,2025-05-11
1kjzcxx,mrqv6in,youngchul,"For stable and rational countries, yes it’s a good defense doctrine.

For religious fundamentalist crazies who will actively use them in war as an agressor, no it’s not. Iran is a batshit crazy regime that spreads terrorism, fights a hybrid war against the west. They kill women and women for dressing too western. They have a sworn goal to destroy Israel.

They need to be stopped before we got another Russia on our hands.",9,2025-05-11 13:29:10+00:00,t1_mrqkef4,424,2025-05-11
1kjzcxx,mrqz8oh,shaunrundmc,"They cant, they backed off once and agreed to a treaty under Obama that Trump immediately reneged on and then slapped a bunch of Tariffs and other punitive measures on them. You cant trust any agreement that Trump makes, and its shown that if you have nukes other countries won't fuck with you or try anything crazy.

This shitstorm was literally resolved like 12 years ago and the 9 yrs ago a dumbass undid it because he hated his predecessor.",9,2025-05-11 13:54:31+00:00,t1_mrqp1m4,444,2025-05-11
1kjzcxx,mrrltgk,shaunrundmc,That ship has sailed and Pakistan is not a T$^%% country. Just like any place there are people that take advantage of the chaos and tension at the borders to be able to launch attacks.,-8,2025-05-11 15:57:50+00:00,t1_mrqzfqh,184,2025-05-11
1kjzcxx,mrqoc7s,xegoba7006,"Nuclear rights > Human rights, of course",8,2025-05-11 12:43:11+00:00,t3_1kjzcxx,40,2025-05-11
1kjzcxx,mrqjqhk,Yaguajay,Who has a “right” to possess weapons capable of wiping out humanity and who doesn’t? Too bad it has come to this.,5,2025-05-11 12:09:07+00:00,t3_1kjzcxx,113,2025-05-11
1kjzcxx,mrtd609,forkoff77,Then they’re going to get nuclear lefts.,4,2025-05-11 21:41:12+00:00,t3_1kjzcxx,40,2025-05-11
1kjzcxx,mrs7rjh,noobwithguns,"We are already seeing what happens when terror states get nukes vis a vis pakistan. 

Let's not let iran get one.",2,2025-05-11 17:53:29+00:00,t3_1kjzcxx,113,2025-05-11
1kjzcxx,mrqy4d1,Level-Negotiation721,So do we have US going into another war with Iran?? Given how some guy had stated there shall be no wars once he is the President.,1,2025-05-11 13:47:37+00:00,t3_1kjzcxx,130,2025-05-11
1kjzcxx,mrtpxpf,ffnnhhw,You saying he lying? Can't shame the shameless.,1,2025-05-11 22:57:52+00:00,t1_mrqy4d1,47,2025-05-11
1kjzcxx,mrrbamd,minus2cats,Good. Hope they have nukes by tomorrow AM.,-5,2025-05-11 15:01:56+00:00,t3_1kjzcxx,42,2025-05-11
1kjzcxx,mrrwzml,Far_Broccoli_8468,"You want iran to have nukes?

Do you have no self preservation instincts? Do you understand what is the end goal of the iranian islamic revolution?",5,2025-05-11 16:57:25+00:00,t1_mrrbamd,147,2025-05-11
1kjzcxx,mrs34e6,minus2cats,Yes. You want the US to have big bombs after they used them on Japanese civilians?,-3,2025-05-11 17:29:17+00:00,t1_mrrwzml,82,2025-05-11
1kjzcxx,mrsl6fp,Far_Broccoli_8468,">Yes

So you support killing everyone that won't turn into a muslim by force, gotcha.

nothing more needs to be said really",3,2025-05-11 19:06:27+00:00,t1_mrs34e6,123,2025-05-11
1kjzcxx,mrsqm7m,minus2cats,I think you've confused the country of Iran with ISIS,-4,2025-05-11 19:36:55+00:00,t1_mrsl6fp,53,2025-05-11
1kjzcxx,mrst6jd,Far_Broccoli_8468,"I don't think i am. Well, i wasn't talking about the entire country per se, just the ayatollah regime and the islamic revolution

ISIS might be more extreme and more ready to put their ideals into actions, but there's very little difference about the basis of the ideology",3,2025-05-11 19:51:13+00:00,t1_mrsqm7m,272,2025-05-11
1kjzcxx,mrsyg5g,minus2cats,"You know non-muslim American citizens, and people from the rest of the world visit Iran often right?

Shitty theocratic govt but it's not Gilead",3,2025-05-11 20:20:04+00:00,t1_mrst6jd,144,2025-05-11
1kjzcxx,mrszsi1,Far_Broccoli_8468,"Say what you will, but you don't give nuclear weapons to a regime that openly claims they want to destroy israel and then the west over and over again (and actually acts towards doing so)",2,2025-05-11 20:27:23+00:00,t1_mrsyg5g,187,2025-05-11
1kjzcxx,mrt13bl,minus2cats,"nobody is giving, they can pursue it on their own.

and the US political class talks about bombing Iran all the time, take their weapons too?",4,2025-05-11 20:34:29+00:00,t1_mrszsi1,141,2025-05-11
1kjzcxx,mrt2d14,Far_Broccoli_8468,">nobody is giving, they can pursue it on their own.

giving... allowing to pursue. tomato tomahto

>US political class talks about bombing Iran all the time

Bombing the nuclear facilities to deny iran a nuclear bomb. Yeah, i have absolutely no problem with that.",0,2025-05-11 20:41:22+00:00,t1_mrt13bl,263,2025-05-11
1kjzcxx,mrs8p5t,GoonestMoonest,I remember arguing your point when I was 15.,3,2025-05-11 17:58:24+00:00,t1_mrs34e6,44,2025-05-11
1kjzcxx,mrsqzem,minus2cats,It's a common moral position a sane 15 year old will develop then lose after a lifetime of US propaganda.,1,2025-05-11 19:38:58+00:00,t1_mrs8p5t,105,2025-05-11
1kjzcxx,mrtgo62,GoonestMoonest,Comparing Iran's intentions to the US in WW2 is a little off IMHO.,2,2025-05-11 22:01:26+00:00,t1_mrsqzem,66,2025-05-11
1kjzcxx,mrtjlar,minus2cats,Comparing a hypothetical intention to a realized use of weapons and calling it a humble opinion is good example of the Western perspective.,2,2025-05-11 22:18:41+00:00,t1_mrtgo62,139,2025-05-11
1kjzcxx,mrsn5f2,Far_Broccoli_8468,"Which point is that?

To be in favor of the enemy of the free world and liberal democracies everywhere?

What a noble cause",1,2025-05-11 19:17:29+00:00,t1_mrs8p5t,123,2025-05-11
1kh2s8l,mr3owj7,macross1984,"Without Iran, Houthis will wither and be neutralized.",20,2025-05-07 17:42:49+00:00,t3_1kh2s8l,53,2025-05-07
1kh2s8l,mr3jb7s,ThoughtseizeScoop,"Gotta say, love all these different assholes bending over backwards to try to appease this moron who could literally walk back anything at a moment's notice simply because he doesn't have any understanding of what's going on.",8,2025-05-07 17:16:33+00:00,t3_1kh2s8l,225,2025-05-07
1kh2s8l,mr3pii9,Tiflotin,"You nailed it. Albeit in this case, the country bending over backwards kinda has to unless they want to get bombed this month. Pretty easy to make a deal when you tell the person you're making a deal with that you'll obliterate them if they don't sign by a certain date. Art of the deal.",8,2025-05-07 17:45:40+00:00,t1_mr3jb7s,287,2025-05-07
1kh2s8l,mr3wvlu,AngryTomJoad,"didnt trump leave the iran nuclear deal that Obama made?

now trump is trying to recreate that Obama deal?

will someone in our press please ask about this?",8,2025-05-07 18:20:23+00:00,t1_mr3jb7s,156,2025-05-07
1kh2s8l,mr47n17,aboysmokingintherain,I mean unfortunately trump is making a deal with brute force for better or worse,2,2025-05-07 19:12:15+00:00,t1_mr3jb7s,80,2025-05-07
1kh2s8l,mr6dcme,dragon1500z,now the usa needs a big fish net to catch the planes at the sea,1,2025-05-08 02:07:00+00:00,t3_1kh2s8l,63,2025-05-08
1kh2s8l,mr3r4w5,captsmokeywork,Houthis say the USA backed down.,-8,2025-05-07 17:53:13+00:00,t3_1kh2s8l,32,2025-05-07
1kh2s8l,mr4zuj6,Akiasakias,"The Houthis wanted to shoot at Jewish shipping interests. 

The US wanted to stop that shooting.

We will know who backed down based on if the shooting continues, and if that shooting is punished.",12,2025-05-07 21:27:39+00:00,t1_mr3r4w5,196,2025-05-07
1kh2s8l,mr6etbi,Number6isNo1,"When was the last Houthi attack on commercial shipping? I thought it was in December 2024, nearly 6 months ago.",1,2025-05-08 02:15:41+00:00,t1_mr4zuj6,111,2025-05-08
1kh2s8l,mr9dg80,Akiasakias,"And now that the cop cars are leaving the crime scene. We may, or may not, see hostilities flare back up.",1,2025-05-08 15:29:19+00:00,t1_mr6etbi,105,2025-05-08
1kh2s8l,mr55sh7,captsmokeywork,Should not take long,-4,2025-05-07 21:58:28+00:00,t1_mr4zuj6,20,2025-05-07
1kh2s8l,mr3s7ru,margotsaidso,"Who the hell knows what's going on. Supposedly Israel didn't even know talks were on-going with the Houthis. We can't trust the narratives coming from the US, Isreal, Iran, Houthis, anyone involved, just have to wait and see what happens.",0,2025-05-07 17:58:11+00:00,t1_mr3r4w5,238,2025-05-07
1kh1iwd,mr39mza,cyclingkingsley,"When anybody says ""so far, so good"" is when they try to spin a positive narrative on something that they have no idea if it's going in their direction",22,2025-05-07 16:30:21+00:00,t3_1kh1iwd,150,2025-05-07
1kh1iwd,mr3x7jb,AngryTomJoad,"aw isnt it sad that trumpy needs the Obama deal with Iran back in place?

what moron walked away from that deal... oh yeah it was trump",3,2025-05-07 18:21:58+00:00,t1_mr39mza,135,2025-05-07
1kh1iwd,mr4557r,Signal_Road,This is also the same person the Pope had receive a lecture on compassion.,1,2025-05-07 19:00:07+00:00,t1_mr39mza,74,2025-05-07
1kh1iwd,mr382by,gonzar09,"Which means nothing, to anyone paying attention.",17,2025-05-07 16:22:42+00:00,t3_1kh1iwd,48,2025-05-07
1kh1iwd,mr3cyef,QBRisNotPasserRating,“Let’s all just take a seat on that couch over there”,5,2025-05-07 16:46:32+00:00,t3_1kh1iwd,53,2025-05-07
1kh1iwd,mr3ubmp,Hour-School-2255,"After his book I essentially assume everything he says publicly is a lie, so it's like a constant opposite day with him",3,2025-05-07 18:08:13+00:00,t3_1kh1iwd,119,2025-05-07
1kh1iwd,mr3chfz,reddityourappisbad,Fall Out Boy wears guyliner.,3,2025-05-07 16:44:16+00:00,t3_1kh1iwd,28,2025-05-07
1kh1iwd,mr3eext,wawaboy,Thanks Pope killer,2,2025-05-07 16:53:23+00:00,t3_1kh1iwd,18,2025-05-07
1kh1iwd,mr5htw7,scenr0,Maybe he shook someones hand again.,1,2025-05-07 23:06:03+00:00,t3_1kh1iwd,35,2025-05-07
1kh1iwd,mr6rurl,Violet-Journey,Did he even say thank you?,1,2025-05-08 03:40:46+00:00,t3_1kh1iwd,26,2025-05-08
1kh1iwd,mr3eswp,arvigeus,Uh-oh... Welp...,0,2025-05-07 16:55:13+00:00,t3_1kh1iwd,16,2025-05-07
1kh1iwd,mr3k7y3,captsmokeywork,"It’s the Dan Quayle effect, who is going to JFK Trump if this idiot is next in line?",0,2025-05-07 17:20:53+00:00,t3_1kh1iwd,84,2025-05-07
1kh1iwd,mr3pzrc,captsmokeywork,The people that pay them usually are.,2,2025-05-07 17:47:56+00:00,t1_mr3ovnh,37,2025-05-07
1kf6t2l,mqoe0og,Repave2348,Fart of the deal strikes again.,2,2025-05-05 08:58:03+00:00,t3_1kf6t2l,31,2025-05-05
1kep34s,mqkok9c,epicredditdude1,"I can’t wait for this deal to be substantially the same as the deal Obama made, but for Trump and MAGA to lose their mind and claim it’s the best deal ever made.",34,2025-05-04 18:08:40+00:00,t3_1kep34s,161,2025-05-04
1kep34s,mqmp0ea,Capital_Ad281,TLDR: Trump wants to restore Obama’s deal which he completely dismantled (because he believed such a deal should be signed by a white man),3,2025-05-05 00:46:41+00:00,t3_1kep34s,138,2025-05-05
1kep34s,mqoatwo,BillPsychological850,"Hey Let’s not all pretend that wasn’t an absolutely horrible deal. There’s a reason he’s getting flack for possible making  the same one. I’ll be absolutely pissed if he does. The deal allowed Iranian officials weeks notice before inspections only at certain sites, and allowed for a very high percent of uranium enrichment which allowed them to near the weapons mark and easily avoid inspections with the lengthy notice time.Obama has many foreign policy failures especially in the middle easy and this was maybe his greatest.  Not only did it allow iran to get extremely close to the weapon , it in return lifted economic sanctions on them for agreeing to the deal. He was every right to cancel that miserable deal, but is an absolute failure if he returns to the same one.",-1,2025-05-05 08:23:45+00:00,t1_mqmp0ea,775,2025-05-05
1kep34s,mqkq1j5,BrassDragonLP,I've played enough Disco Elysium to know why a 'civilian nuclear program' probably isn't a good thing,1,2025-05-04 18:16:11+00:00,t3_1kep34s,101,2025-05-04
1kd69oq,mq8cr5v,PsychLegalMind,It is not because of logistical issues; it is because of threats made against Iran pertaining to the conflict in Yemen. At least this is what the Iranian media is reporting.,6,2025-05-02 17:29:36+00:00,t3_1kd69oq,173,2025-05-02
1kd69oq,mqawx9g,Right_Ostrich4015,"Was it logistics? Or was it Cheetoh Mussolini threatening “any country using Iranian oil”, ie. China",2,2025-05-03 01:43:16+00:00,t3_1kd69oq,100,2025-05-03
1kd69oq,mqhau5o,PluginAlong,Maybe someone couldn't find a babysitter sitter for their kids.,1,2025-05-04 03:27:28+00:00,t3_1kd69oq,63,2025-05-04
1k8f840,mp62ea6,dallasmav40,I seriously doubt he’s figured it out yet,2,2025-04-26 16:26:07+00:00,t3_1k8f840,41,2025-04-26
1k8f840,mpej2n9,AppleTree98,"Moscow and Tehran have reached a deal on 55 billion cubic metres of Russian gas supplies a year, though prices are yet to be agreed, while Russia also pledged to fund construction of a new nuclear power plant in Iran, officials said on Friday.

So how do we determine who the enemies and friends or frenemies are on the board now? Enemy of my enemy is my friend. So China is suppling Russia weapons, BAD?! Or is that good in the eyes of US leadership. Russia is funding a new nuclear power plan in Iran, that is BAD!? Or is that good since US leadership wants to enable Russia.",1,2025-04-28 00:17:07+00:00,t3_1k8f840,577,2025-04-28
1k7e0yu,moy442p,Neither-Complaint757,No. Any talks with iran is waste of time.,1,2025-04-25 10:38:14+00:00,t3_1k7e0yu,41,2025-04-25
1k7e0yu,moxfrth,Hot-Spread3565,"Iran should state that the the united states of aresholes has shown itself to be unstable, therefore they should be prohibited from having nuclear weapons.",-3,2025-04-25 06:32:21+00:00,t3_1k7e0yu,155,2025-04-25
1k69i4p,moo9n6v,ejohn916,Didn't Obama already have this in place at one time?,14,2025-04-23 20:44:24+00:00,t3_1k69i4p,52,2025-04-23
1k69i4p,moofbfk,pssssn,"Until Trump admin v1 eliminated the inplace agreement, yes.",15,2025-04-23 21:12:01+00:00,t1_moo9n6v,59,2025-04-23
1k69i4p,moo8oum,StormFireX001,"Let me guess, now Trump is going to rebrand the JCPOA",10,2025-04-23 20:39:51+00:00,t3_1k69i4p,53,2025-04-23
1k69i4p,mood4n8,ComplexWrangler1346,Trump wil say he did this that scum,4,2025-04-23 21:01:13+00:00,t3_1k69i4p,35,2025-04-23
1k4ry5e,mocnknu,nerphurp,">which in one notable section doubled down on Tehran's emphasis on the potential investment value of a new nuclear agreement with Washington as the two sides engage in talks.

Before establishing an actual deal we'll be supplying Iran with weapons-grade nuclear material with Rubio stating 'at this point we're just trying to get them to the table'",37,2025-04-22 00:37:51+00:00,t3_1k4ry5e,348,2025-04-22
1k4ry5e,mod8bt5,Draviddavid,It must be opposite year.,14,2025-04-22 02:37:51+00:00,t3_1k4ry5e,25,2025-04-22
1k4ry5e,moctbeu,i_am_a_lurker69,What a confusing timeline,27,2025-04-22 01:11:09+00:00,t3_1k4ry5e,25,2025-04-22
1k4ry5e,modt1iu,Exotic_Exercise6910,"Trump's new favourite countries:
Russia, Iran.

Coolsies",16,2025-04-22 05:03:58+00:00,t3_1k4ry5e,56,2025-04-22
1k4ry5e,moddjbx,Max_Fenig,Epic trolling right there. Too bad they didn't have the stones to answer questions. Could have be hilarious.,5,2025-04-22 03:10:47+00:00,t3_1k4ry5e,108,2025-04-22
1k4ry5e,modi8ms,macross1984,"If Trump is as idiot he has shown himself, he may bite it. :P",5,2025-04-22 03:42:55+00:00,t3_1k4ry5e,61,2025-04-22
1k4ry5e,moent3k,Preference-Inner,six adjoining piquant instinctive bike seed absorbed rob heavy aback,5,2025-04-22 10:17:51+00:00,t3_1k4ry5e,68,2025-04-22
1k4ry5e,modla5h,TokenBearer,Only allow them to use Thorium.,2,2025-04-22 04:04:05+00:00,t3_1k4ry5e,31,2025-04-22
1k4ry5e,moiy9py,-Freddybear480,Didn’t have that on my 2025 bingo card.,1,2025-04-23 00:19:33+00:00,t3_1k4ry5e,39,2025-04-23
1k47cxm,mo7y5ja,ConsequenceVast3948,Of course it's the JCPOA.the only reason he pulled usa out of it was because it was Obama's deal.now he want to repeat it and take the credit.,105,2025-04-21 07:18:33+00:00,t3_1k47cxm,142,2025-04-21
1k47cxm,mo8mfw0,Voaracious,I don't care let him take as much credit as he wants. If it keeps Iran from a nuke I'll sleep easier at night.,-8,2025-04-21 11:21:53+00:00,t1_mo7y5ja,110,2025-04-21
1k47cxm,mo9mo9e,American_Brewed,"In the end, Iran is still going to produce the weaponry and do exactly what they’ve been clear about: destroying Israel",7,2025-04-21 15:04:01+00:00,t1_mo8mfw0,119,2025-04-21
1k47cxm,mof2uyq,AVaudevilleOfDespair,How? Israel has nukes.,1,2025-04-22 12:16:28+00:00,t1_mo9mo9e,22,2025-04-22
1k47cxm,mof80lm,American_Brewed,"Nukes are a “defensive deterrent”, at least the way it’s strategized in the west and portrayed through doctrine. 

Once folks realize the regime in Iran has a clear goal of destroying Israel and are unwilling to follow or cooperate on the global stage with destructive weaponry, then EVERYONE with the potential to develop this weaponry will do so. I’m not just saying Iran wants to destroy Israel because I’m American, but their regime has made it so blatantly clear it hurts. That’s to end the state of Israel, whether you agree with Israel or not on any foundation. Israel “generally” listens to the US, lately I question that, but I feel Israel would cooperate if it came to the actual potential of a nuclear device detonating, whether strategic or civilian targets, and whether it would be offensive or defensive. 

I don’t agree with nukes whatsoever, they’re deadly and destructive and their only goal is destruction and fear, and I personally think the west is a bit hypocritical when it comes to nuclear weapons, but since they exist now and are in great numbers and with incomprehensible destructive capacity, we need cooperative programs and oversight to prevent this weaponry from being all loosy goosy and just getting into the hands of radicals, no matter their radical ideals. Islam is an easy one to pick on since Americans have been doing it for 20 years, but that ALSO means even America too being ran by a fascist like state with an arsenal exceeding 6,000.. it’s a completely different ball game compared to WW2 and it’s honestly incredibly terrifying. 

Nukes should scare people, it’s the whole purpose of the peace symbol.

People should be paying attention to the changes in nuclear doctrine, especially in the US, because we’ve subscribed to the mutual destruction theory, but others with nukes see them as another piece on the chess board and see it being an excellent tool for manipulation and altering battle field conditions.",2,2025-04-22 12:49:47+00:00,t1_mof2uyq,1954,2025-04-22
1k47cxm,mobgnob,Local-Friendship8166,Spoiler. They already have nukes.,1,2025-04-21 20:42:17+00:00,t1_mo8mfw0,33,2025-04-21
1k47cxm,mo90wjk,DisasterNo1740,"I mean it is a repeat of that deal except Iran couldn't be happier because of the precarious position they're in, they're somehow getting what they want and more lmfao.",7,2025-04-21 13:04:13+00:00,t3_1k47cxm,168,2025-04-21
1k47cxm,mo85k1j,Luna__Moonkitty,"If he gets oil to drop even more in price, it might just bankrupt Saudi Arabia. And imagine what that would do to all the sports leagues and businesses they've invested in.",2,2025-04-21 08:37:21+00:00,t1_mo802b1,172,2025-04-21
1k47cxm,mo88m89,tossawayprop,"It won't. Saudi Arabia has the lowest extraction and pumping costs in the world. 

It will, however, bankrupt anyone extracting oil from North American shale deposits. And Russia.",25,2025-04-21 09:09:34+00:00,t1_mo85k1j,179,2025-04-21
1k47cxm,moejemr,MrAnderson69uk,"I posted a reply to a subreddit post with an excerpt from my research on Consensus GPT, and SA and middle eastern oils are the cheapest due to being normal oil field deposits whereas US oil is Shale Oil and offshore both of which are expensive to extract, process and transport - Shale being most expensive at 6x the cost of SA and Middle Eastern oils! 

AND, the cost per barrel is pretty much at the breakeven point now for US oil - reducing the OPEC set price of a barrel will mean the US oil will be produced at a loss. Canadian oil, Sand Oil, as the guy below says is cheaper to produce than US oil! 

Trump doesn’t know business!",1,2025-04-22 09:33:21+00:00,t1_mo88m89,635,2025-04-22
1k4784w,mo90bwn,NyriasNeo,"'Now, even the unlikely is possible'

This is just stupid. ""Unlikely"", by definition, is ""possible"". If it is not possible, the word is ""impossible"".",7,2025-04-21 13:00:33+00:00,t3_1k4784w,149,2025-04-21
1k4784w,moadf2l,Scipion,"Oman is so cool, they're really taking their stance as peaceful mediators to heart.",5,2025-04-21 17:29:51+00:00,t3_1k4784w,83,2025-04-21
